	Date	User	Tweet
0	2017-12-27 20:30:42+00:00	Bloomberg	Through various cultural partnerships with Bloomberg Philanthropies, our company plays a role in advancing creativity, innovation, public access and new technologies in the arts. https://t.co/msASVexWCj https://t.co/YhrMEkhZpq
1	2017-12-27 17:24:12+00:00	Bloomberg	Regulators give fresh sign they'll go easy on MiFID rules: https://t.co/0DDEClCqN2 https://t.co/1uWwON444T
2	2017-12-24 11:39:05+00:00	Bloomberg	Rise of quant: New hedge funds next year to embrace high tech https://t.co/H6dOZAJogY https://t.co/hPhVE70tsr
3	2017-12-23 10:38:06+00:00	Bloomberg	Central banks are turning to big data to help them craft policy https://t.co/gmAe5B4Oim https://t.co/qpKb97xBQJ
4	2017-12-22 18:20:27+00:00	Bloomberg	Why working at Bloomberg was incredible in 2017: https://t.co/TPR24EpSGv https://t.co/AhgPJkfXpH
5	2017-12-22 14:27:41+00:00	Bloomberg	Through Bloomberg Startup, our employees help to grow strong global leaders of the future by collaborating closely with our non-profit education partners. https://t.co/5riMfXyhm6 https://t.co/FadfGrivzX
6	2017-12-21 15:20:17+00:00	Bloomberg	Growth-blessed Southeast Asia has more to cheer about in 2018: https://t.co/3y9JDY0IIW https://t.co/7ureq2IEs2
7	2017-12-20 15:46:02+00:00	Bloomberg	New year, new regulations as MiFID II and PRIIPs become reality: https://t.co/MJcNjjHWDb https://t.co/Vd5ucy8eOH
8	2017-12-19 18:51:11+00:00	Bloomberg	Happy holidays from Bloomberg LP. https://t.co/v8jWzLb73j
9	2017-12-18 21:15:49+00:00	Bloomberg	Today, we launched TicToc by Bloomberg, the first 24/7 global social news network built for @Twitter. Our unique partnership combines our global news room with the social platform consumers turn to for breaking news. Follow @TicToc to get started. https://t.co/S7Io73D1bN
10	2017-12-15 19:15:54+00:00	Bloomberg	The U.K.’s breakthrough deal to get Brexit talks moving on to the future trading relationship may be short-lived:  https://t.co/st7vWPHcFd https://t.co/OJGxMRx8Yh
11	2017-12-14 00:09:38+00:00	Bloomberg	The perception of homosexuality in the finance sector in Asia has evolved; corporate initiatives are ensuring safe environments for LGBTIQ people: https://t.co/v3OFJo6tFg https://t.co/9Z22LW4Cl5
12	2017-12-13 20:56:44+00:00	Bloomberg	Emerging markets shrug off crises for best gains in eight years:  https://t.co/KGLCFUxgib https://t.co/YpXJsFCXPu
13	2017-12-12 18:28:09+00:00	Bloomberg	Inclusive decision making can bring about faster change in the workplace and better business performance: https://t.co/qIJlAojGHg https://t.co/6NRFM3SKfJ
14	2017-12-08 16:15:07+00:00	Bloomberg	Wall Street has no idea what's going to happen to credit markets in 2018: https://t.co/O2ECEDUrgk https://t.co/iKDgnT8o3V
15	2017-12-07 16:33:03+00:00	Bloomberg	Why the stock wobble isn’t helping gold: https://t.co/tMiQhq7p8Z https://t.co/Le3O1xeGaJ
16	2017-12-06 18:29:59+00:00	Bloomberg	What is groupthink and how are millennials helping with diversity of thought? https://t.co/3JCoRRTmLM https://t.co/gFpBrNHb8a
17	2017-12-06 15:26:53+00:00	Bloomberg	Copper is flashing red as stockpiles and spreads point bearish: https://t.co/1FrQOyL32F https://t.co/SrpyyA4rWr
18	2017-12-05 14:57:03+00:00	Bloomberg	The pound is enjoying a fresh wave of confidence from investors: https://t.co/6VUU9VzYq8 https://t.co/tawBuDi1NM
19	2017-12-04 16:54:26+00:00	Bloomberg	Emerging market bonds shrug off political risk as elections loom: https://t.co/UMVQ0VuctF https://t.co/2JKpthepUT
20	2017-12-01 19:07:48+00:00	Bloomberg	For #WorldAidsDay, we're raising awareness to help reduce stigma and advance HIV treatment and education around the world.  #LetsEndIt https://t.co/w3RRzI4HtE
21	2017-12-01 15:25:33+00:00	Bloomberg	These are the signs that stocks are starting to turn really bullish on tax reform: https://t.co/cKMzRDEsrh https://t.co/xFyIxgK9Zw
22	2017-11-29 21:08:54+00:00	Bloomberg	Why the world-beating won is likely to escape intervention: https://t.co/Ve8RiHJX6w https://t.co/8zjHYrHwF8
23	2017-11-29 18:21:33+00:00	Bloomberg	Junk-avoiding budget plans may hurt South African growth: https://t.co/n0s9ZztLLK https://t.co/T47Nesmux1
24	2017-11-28 13:33:21+00:00	Bloomberg	BOE says stress test shows banks can withstand disorderly Brexit: https://t.co/4Pj3uvczrH https://t.co/pbVb8khCQW
25	2017-11-27 16:05:21+00:00	Bloomberg	Emerging-market investors can almost always count on South Africa to keep them on their toes: https://t.co/e8LKIMf867 https://t.co/Ke5Bdg8GW4
26	2017-11-24 15:11:47+00:00	Bloomberg	Thank record-high stock prices for a flattening U.S. yield curve: https://t.co/I2ysSdCLlg https://t.co/VigoAS8c7F
27	2017-11-20 19:14:37+00:00	Bloomberg	.@AnandaNahu's original pieces communicate the powerful culture, innovation &amp; impact of diversity in our society &amp; economy. See more about our collaboration:  https://t.co/Z5TvBCyHsi https://t.co/w2Lbwr8HbO
28	2017-11-17 14:11:15+00:00	Bloomberg	Investment assets that put women first surge past $2.2 billion: https://t.co/fLRjEyzN2M https://t.co/jc7GOM7ing
29	2017-11-16 13:56:35+00:00	Bloomberg	October ETF inflows continue as $40 billion heads into stocks: https://t.co/i8pKiQWPUy https://t.co/ixIu2ojQOd
30	2017-11-14 02:00:06+00:00	Bloomberg	Abe administration made advancing women in Japan's labor force a top priority, but more still needs to be done: https://t.co/j81gqj3Sbp https://t.co/DeZSJqBVQo
31	2017-11-13 22:33:39+00:00	Bloomberg	Defeating cancer in our lifetime starts with knowing the facts. https://t.co/fYpEl0a4cO
32	2017-11-13 17:30:03+00:00	Bloomberg	Incorporating new technology: Disguising a UX revolution within an evolution https://t.co/pT3rn5nsSU https://t.co/fzwuEKCNVv
33	2017-11-11 14:00:11+00:00	Bloomberg	We proudly support veterans, their families, and all who have served around the world.  #LearnFromAVet https://t.co/jfuQ7OZhsu
34	2017-11-09 20:45:07+00:00	Bloomberg	Employees are less likely to perceive bias when company leaders are from diverse demographic backgrounds: https://t.co/81yVkxGqBg https://t.co/X4DszflaGB
35	2017-11-09 17:16:58+00:00	Bloomberg	We’re honored to be named a Best Place to Work for #LGBT Equality, earning a 100% on @HRC’s Corporate Equality Index for the second year in a row #CEI2018 https://t.co/gWq35KLj3c
36	2017-11-09 08:27:19+00:00	Bloomberg	Tonight is the fourth @SquareMileHK where 1,250 runners are set to tackle this one-of-a-kind course. &lt;GO&gt; teams! #WeRunThisCity https://t.co/8l8PMj4DIZ
37	2017-11-08 22:12:03+00:00	Bloomberg	The promise and perils of machine learning in the enterprise:   https://t.co/OVhUEvARkf https://t.co/QSoEEXk8N2
38	2017-11-08 17:35:04+00:00	Bloomberg	Recognized by @BuiltInNewYork, we're leading the innovation ecosystem as the largest tech employer HQ’d in NYC: https://t.co/4wfW4PocYC https://t.co/4w7oyqU8g7
39	2017-11-08 11:18:49+00:00	Bloomberg	Bloomberg’s new European headquarters is built on a special place -- London’s Roman Temple of Mithras: https://t.co/SncODI7BiV https://t.co/EMGUTYVrEX
40	2017-11-08 10:29:03+00:00	Bloomberg	London Mithraeum Bloomberg SPACE to Bring Roman Temple of Mithras to Life: https://t.co/aHBqt5qAvW #LondonMithraeum
41	2017-11-07 15:35:36+00:00	Bloomberg	Foreigners try a new strategy in China's fragile bond market: https://t.co/OgQrsaR373 https://t.co/xGTQkcVrPM
42	2017-11-03 16:24:03+00:00	Bloomberg	Even the smallest Gulf economy is too big to fail: https://t.co/rRQd0GGNex https://t.co/jlXYqedDdW
43	2017-11-02 13:50:40+00:00	Bloomberg	Chinese analysts fleeing MiFID are returning home: https://t.co/136jdx070P https://t.co/CjQRpERwjJ
44	2017-10-31 15:13:03+00:00	Bloomberg	Saudi Arabia leads Gulf nations in cutting break-even oil price: https://t.co/QlCiWpxJMP https://t.co/kMRaMcj1Bf
45	2017-10-31 13:06:45+00:00	Bloomberg	Britain’s taxman wants to make money from MiFID: https://t.co/tva4UquXqI https://t.co/G2PHzNWfgs
46	2017-10-30 12:59:53+00:00	Bloomberg	Two years of reform and Saudi stocks have little to show for it: https://t.co/JFt0LnQGxG https://t.co/ouaUtx3tQH
47	2017-10-27 19:11:05+00:00	Bloomberg	Brazil's falling spreads likely to spur corporate bond sales: https://t.co/OmgHCReb7X https://t.co/3YgWNE3OnI
48	2017-10-26 08:02:40+00:00	Bloomberg	It’s Race Day for Singapore's 5th Bloomberg Square Mile Relay. Follow #Werunthiscity for updates. &lt;GO&gt; teams! @SquareMileSG https://t.co/APJrXoMpsK
49	2017-10-25 15:40:15+00:00	Bloomberg	Neurodiverse people are wired differently and bring new perspectives – a workplace competitive advantage: https://t.co/TOH9Rfc3pZ https://t.co/nqPPAgw3Yj
50	2017-10-25 12:00:04+00:00	Bloomberg	Welcoming all levels of society is part of breaking down barriers in Brazil: https://t.co/Qab5fGWEBb https://t.co/83zafyT25w
51	2017-10-25 08:56:48+00:00	Bloomberg	Your guide to the many flavors of quantitative finance: https://t.co/XzxjOwCGqG https://t.co/WV11BvHxNO
52	2017-10-24 12:04:16+00:00	Bloomberg	.@MikeBloomberg on the new European HQ's importance to our employees, customers and the community. #BloombergLondon https://t.co/hYdHn7y8Je
53	2017-10-24 11:00:27+00:00	Bloomberg	The building delivers a 73% saving in water consumption and a 35% saving in energy consumption &amp; associated CO₂ emissions. #BloombergLondon https://t.co/P7Lj7NjIif
54	2017-10-24 10:25:56+00:00	Bloomberg	The interior of the building is designed to bring people together and encourage chance interactions. #BloombergLondon https://t.co/auaRXZhpvd
55	2017-10-24 10:03:24+00:00	Bloomberg	The new building is meant to fit respectfully into the City while adding to its character and giving back to the community. #BloombergLondon https://t.co/0iFACDYaCV
56	2017-10-24 09:40:22+00:00	Bloomberg	Our new European HQ is designed with sustainability, innovation, community and collaboration at the forefront. #BloombergLondon https://t.co/E7n7yTx8uV
57	2017-10-24 09:18:05+00:00	Bloomberg	Welcome to Bloomberg’s new European headquarters: https://t.co/RgCj2rzFla #BloombergLondon https://t.co/by1rWNH7nS
58	2017-10-23 20:34:00+00:00	Bloomberg	Wall Street is redesigning the trade desk to better accommodate coders - and it's shaping the future. https://t.co/PIS2wr2Pf8 https://t.co/Bt8qyKUoSR
59	2017-10-23 16:51:38+00:00	Bloomberg	In celebrating #BlackHistoryMonth UK, we recognize the rich heritage &amp; culture that defines our employees' lives. https://t.co/PfrklTi6QG https://t.co/K1u4nJQ7ER
60	2017-10-19 21:10:08+00:00	Bloomberg	That's a wrap on #TBKCharityDay 2017! Thank you to everybody involved in raising money for charities across the world! https://t.co/oy2VDTeVma
61	2017-10-19 20:10:05+00:00	Bloomberg	.@PadmaLakshmi shared her passion and brought awareness around @EndoFound to the trade floor for #TBKCharityDay. https://t.co/qniDolQoia
62	2017-10-19 19:39:14+00:00	Bloomberg	.@NickMangold was on the trade floor to benefit @AnswerTheCall &amp; families of fallen New York police officers &amp; firefighters. #TBKCharityDay https://t.co/nCmiS441N6
63	2017-10-19 10:27:07+00:00	Bloomberg	#TBKCharityDay is about celebrities supporting their charities. Benedict Cumberbatch and @siobhanhewlett are here for @royalmarsden. https://t.co/udzMTSVB6o
64	2017-10-19 08:17:54+00:00	Bloomberg	Today is #TBKCharityDay and London is ready to trade and raise funds for @royalmarsden, @NoahsArkHospice, @RMHCUK and @princestrust. https://t.co/Jku6e9zuQs
65	2017-10-19 07:09:31+00:00	Bloomberg	.@cocolee117 crushed it today! Thanks for trading for a good cause. #TBKCharityDay @FoodlinkHK https://t.co/NimYD17QpJ
66	2017-10-19 04:35:29+00:00	Bloomberg	.@GEMoving trading to raise funds at #TBKCharityDay in support of saving sight worldwide. @ORBISHongKong https://t.co/ZXVGJU0dPz https://t.co/MejBppYbgq
67	2017-10-19 00:49:57+00:00	Bloomberg	We're kicking off our 6th annual Tradebook Charity Day in Hong Kong. Let's raise some money for good! #TBKCharityDay https://t.co/JkDrNEMa0F https://t.co/LWs9Yk98gb
68	2017-10-18 13:08:23+00:00	Bloomberg	As no-deal Brexit fears grow, here's your trading cheat sheet: https://t.co/Bab9th0l4f https://t.co/eGzqdZ0PEf
69	2017-10-16 14:40:12+00:00	Bloomberg	AI is changing the skills needed of tomorrow's data scientists: https://t.co/w0Qt4tws7L https://t.co/oubnHUdWPd
70	2017-10-16 08:01:56+00:00	Bloomberg	Employees with disabilities are often overlooked due to a lack of awareness. Here’s why and how employers can help: https://t.co/dxQzjNFSa7 https://t.co/2uZZw783Yc
71	2017-10-13 19:16:01+00:00	Bloomberg	When campus leaders ensure Latinx students are supported inside and outside the school, graduation success follows: https://t.co/6Dy195Jxuc https://t.co/IoXQheCc7D
72	2017-10-12 16:17:07+00:00	Bloomberg	Macro currency investors are suffering worst year on record: https://t.co/Umkc4vgBwx https://t.co/OJJ41p05Zy
73	2017-10-11 20:45:40+00:00	Bloomberg	How deep will Saudi cut its oil output? https://t.co/hvLYjJHclj https://t.co/Zp677938U5
74	2017-10-10 18:56:05+00:00	Bloomberg	Mental health in the workplace is stepping out of the shadows and into conversations: https://t.co/GHsQiXgC3j #WorldMentalHealthDay https://t.co/UagZr6D8kJ
75	2017-10-10 17:02:38+00:00	Bloomberg	Selloff brings bond bulls back to India: https://t.co/3VmhmqhjSN https://t.co/RMjzorLcsX
76	2017-10-09 14:25:33+00:00	Bloomberg	Brexit chills car sales in first September drop since 2011: https://t.co/zj6S149hIM https://t.co/SjyGNSwOF1
77	2017-10-06 13:46:04+00:00	Bloomberg	Brazil's dicey politics steer traders to election hedges: https://t.co/KJhoJ4LuU0 https://t.co/xj7N1zc6S5
78	2017-10-05 13:42:37+00:00	Bloomberg	Five reasons why China's rating cut doesn't matter for its bonds: https://t.co/xOEIM2sEdU https://t.co/cgIhKMlvsv
79	2017-10-04 19:45:21+00:00	Bloomberg	What was once a niche, the Hispanic segment is now one of the largest markets in the U.S. https://t.co/3ZB74PpJOC #HispanicHeritageMonth https://t.co/3DEiGNL1yq
80	2017-10-03 15:45:02+00:00	Bloomberg	By 2020, 4-5 generations will be working side by side, here’s how companies can help create a cohesive culture.  https://t.co/6nP4Vcu0Bg https://t.co/WwOFZGV7Hh
81	2017-10-03 12:57:38+00:00	Bloomberg	Our new European HQ sets a new standard for sustainable office design -- rated the most sustainable in the world: https://t.co/Cru87b8XFc https://t.co/tM5AHVKzah
82	2017-09-29 15:07:56+00:00	Bloomberg	Three ways CIOs can beat the innovation curve: https://t.co/8DPGzoFUsT https://t.co/bKWCp79tX5
83	2017-09-28 17:01:10+00:00	Bloomberg	Who's leading the world's largest electric car market? Not Tesla: https://t.co/m5wKdzkhYz https://t.co/R1jp9GdeW7
84	2017-09-27 22:35:05+00:00	Bloomberg	Since our earliest days, we’ve always valued and supported the powerful impact the arts can have in our communities. https://t.co/pOK965B9AR https://t.co/2WMAJHKNHc
85	2017-09-27 13:05:42+00:00	Bloomberg	Brexit negotiators fight over rising EU bill as liabilities grow: https://t.co/bllXomqFNX https://t.co/Rtf3Zn5y8M
86	2017-09-26 20:00:06+00:00	Bloomberg	Dissolving gender barriers, captivating elementary school girls’ interest in STEM can increase more women in tech. https://t.co/P6CZX7uLON https://t.co/CUJDq0A7J6
87	2017-09-26 18:51:59+00:00	Bloomberg	Big private equity funds are killing it, so are small funds dead? https://t.co/61sD42hpAb https://t.co/KxjkvsPmw8
88	2017-09-26 12:18:18+00:00	Bloomberg	Here's one commodity rally that may turn out to be short-lived: https://t.co/fJ7R0gWNJT https://t.co/xaPFs7TceJ
89	2017-09-25 14:50:16+00:00	Bloomberg	Path to India reforms eased as Modi turns enemies into friends: https://t.co/9i0iU36jNT https://t.co/rMGp7YZXTG
90	2017-09-22 14:41:02+00:00	Bloomberg	Iron ore sinks as 'peak steel' call, supply angst rattle market: https://t.co/A5lAgRKvRQ https://t.co/loz7B4S7dT
91	2017-09-21 12:59:46+00:00	Bloomberg	Britain’s not-so-sweet options for an EU trade deal: https://t.co/wvlfIpanVq https://t.co/e8PdCKK0XL
92	2017-09-20 20:53:42+00:00	Bloomberg	“Companies are a collection of people and you have a responsibility to do something for the world…” #BloombergGBF https://t.co/fdgXkk5qCh
93	2017-09-20 17:19:20+00:00	Bloomberg	Saudi media group SRMG announces launch plans for 'Bloomberg Al Arabiya' network: https://t.co/vML7fFqWiA https://t.co/ZY7L4jF8SG
94	2017-09-20 13:54:25+00:00	Bloomberg	Traders are turning to 2017's worst stocks in search of big returns: https://t.co/9zd7dFo0a0 https://t.co/OSW4AjTTgR
95	2017-09-19 18:00:05+00:00	Bloomberg	Employers can help African Americans and Hispanics improve their financial wellness and break the disparity cycle. https://t.co/9YwbOsrBQC https://t.co/25C92ldPgP
96	2017-09-18 16:00:12+00:00	Bloomberg	After Brexit, U.K. won’t have to follow EU’s minimum standards for worker protections, raises concerns for women.  https://t.co/L6DBdfofvU https://t.co/tvHN1DEseV
97	2017-09-18 15:17:37+00:00	Bloomberg	U.K. companies urge May to seek three-year Brexit transition: https://t.co/4HMcnSYPoq https://t.co/fWzukejU5p
98	2017-09-15 15:20:07+00:00	Bloomberg	For #HispanicHeritageMonth, we celebrate a rich culture and history because we are #BloombergUnidos. https://t.co/ehmY9pEmGt
99	2017-09-14 18:30:06+00:00	Bloomberg	LGBT business leaders are looking beyond the past and leveraging the value they bring to the industry and ROI. https://t.co/R0S2vFDX0D https://t.co/K3QpgHqbEG
100	2017-09-14 15:38:19+00:00	Bloomberg	Why the future of machine learning will be crunching words: https://t.co/Gwwe18dPFT https://t.co/qwK1R8LwGm
101	2017-09-13 17:00:09+00:00	Bloomberg	Character like any muscle can be developed; traits which helped these African-American entrepreneurs succeed. https://t.co/wBTAkCMBgh https://t.co/7iy8t4Zdal
102	2017-09-13 14:07:21+00:00	Bloomberg	Strong Turkish growth alone not enough to extend lira's rally: https://t.co/MDqitq1Bc5 https://t.co/wlgpj2lIy5
103	2017-09-12 13:27:56+00:00	Bloomberg	Nigeria’s economy expands to end worst slump in 25 years: https://t.co/OFZGOd78ea https://t.co/mfoyU85pEA
104	2017-09-08 12:00:08+00:00	Bloomberg	Motherhood is changing, and so are mothers' working lives. But why are economists concerned? https://t.co/4RzwmF0fUZ https://t.co/wwSYycPepB
105	2017-09-07 13:33:57+00:00	Bloomberg	Russia expands grip on wheat exports as Asia set to buy more: https://t.co/SD1OxyivEQ https://t.co/i0uptlBvkl
106	2017-09-06 18:04:05+00:00	Bloomberg	Inside UX: Creating a more engaging way to experience Bloomberg Television https://t.co/nm9m69mPp4 https://t.co/xJyB3WVRWd
107	2017-09-05 14:54:09+00:00	Bloomberg	Social media and a day in the life of a compliance officer: https://t.co/Xmjxh0B88v https://t.co/lV3oG0zGNb
108	2017-09-01 18:24:42+00:00	Bloomberg	Six trillion reasons why a shrinking stock market is up:  https://t.co/LjAtthTzZW https://t.co/LliXs2w4Mq
109	2017-09-01 17:30:04+00:00	Bloomberg	Population aging will fundamentally alter the landscape in which businesses operate. What should be done to prepare? https://t.co/Pj1zNDUdGF https://t.co/sTiG1AaFgW
110	2017-08-31 15:41:36+00:00	Bloomberg	Quick guide for those who can't figure out a naira's worth: https://t.co/RwjSx190XM https://t.co/0y4YHxsjwO
111	2017-08-30 17:02:48+00:00	Bloomberg	A Brexit logjam is looming at the Bank of England: https://t.co/4RcdnbZuSv https://t.co/pdq6ivJdxN
112	2017-08-29 18:48:28+00:00	Bloomberg	Small hedge funds seen quickest to drop research under MiFID: https://t.co/BUrhScFJll https://t.co/F6XxQA4K4G
113	2017-08-29 13:43:40+00:00	Bloomberg	Philippines, Indonesia and India have got a Fed problem: https://t.co/nLKaQSZFIs https://t.co/CxfpLkmOU6
114	2017-08-28 17:30:31+00:00	Bloomberg	Wealth managers to funds: Pay MiFID research costs yourselves  https://t.co/lWhZvBfvB2 https://t.co/sLL3DlO8pi
115	2017-08-25 16:04:24+00:00	Bloomberg	Watch on Sunday: @60Minutes will re-air their @MikeBloomberg segment featuring @TheTerminal and more https://t.co/NVeASZDwAB https://t.co/PJof1FDdWZ
116	2017-08-25 14:23:37+00:00	Bloomberg	What shade of green is Asia's best environment-friendly fund? https://t.co/U0toAdf7Yk https://t.co/akp8cN3JRf
117	2017-08-24 12:43:36+00:00	Bloomberg	Lots of firms may dodge the full brunt of MiFID: https://t.co/MuTx1kNqGF https://t.co/p7WjIbbrou
118	2017-08-23 16:27:31+00:00	Bloomberg	Gold's rally against oil is heating up: https://t.co/RqhpFRWi8y https://t.co/8yeCrmsyUC
119	2017-08-23 13:44:08+00:00	Bloomberg	New breed of super Quants prep for Wall Street: https://t.co/OHnAsKtE1X https://t.co/Za91t5a7v5
120	2017-08-22 19:18:05+00:00	Bloomberg	As China's vast bond market opens up, here's the best way in: https://t.co/9mP7FP0jp9 https://t.co/y975Tn1Oxw
121	2017-08-22 08:00:09+00:00	Bloomberg	Eliminating gender gaps at work could add 150 billion pounds ($187 billion) to U.K.’s annual GDP by 2025. https://t.co/iJssqKqVf4
122	2017-08-21 19:46:12+00:00	Bloomberg	Wealthy investors are leaving hedge funds for real estate: https://t.co/53UgaqzPO0 https://t.co/Vpjt9pk9XB
123	2017-08-18 15:45:05+00:00	Bloomberg	A multicultural team brings many benefits to an organization, but only if the team works together harmoniously: https://t.co/whSP3S8hyK https://t.co/fAYcFFpxF3
124	2017-08-17 13:50:17+00:00	Bloomberg	Private equity firms are continuing to diversify away from, well, private equity: https://t.co/dOxZlJyRWV https://t.co/UQA3ogSeRI
125	2017-08-16 18:40:03+00:00	Bloomberg	A mentor can help a young woman chart the path; but experts add – they also need a sponsor to push them ahead:  https://t.co/BSUB4H8xxA https://t.co/mfKRdoJs88
126	2017-08-15 13:58:57+00:00	Bloomberg	Iron's Jekyll-and-Hyde moment shows this rally's 'dangerous': https://t.co/n2KxGII1kW https://t.co/P0e1b5rzvM
127	2017-08-14 13:18:31+00:00	Bloomberg	China is taking on the ‘original sin’ of its mountain of debt: https://t.co/DNDgh7cYPM https://t.co/Ia0jR53iVn
128	2017-08-11 13:25:41+00:00	Bloomberg	In China's hedge fund industry, global managers are a tough sell: https://t.co/in51Leilw4 https://t.co/fPl722UEuQ
129	2017-08-10 15:01:14+00:00	Bloomberg	Keep Japan ‘Locust Lords’ on Twitter radar if you own yen stocks: https://t.co/Qbgay1ZWOz https://t.co/d3P1xrh21O
130	2017-08-10 03:30:03+00:00	Bloomberg	"Most Indian women either never enter the work force, or drop out early in their careers. What can be done to help?
https://t.co/LZ9jjVumK7 https://t.co/O3i6B2u8Dc"
131	2017-08-09 14:35:51+00:00	Bloomberg	The case against emerging markets is gaining steam in one corner of the bond world: https://t.co/0Ocoky9pV8 https://t.co/426bt5feay
132	2017-08-08 15:23:02+00:00	Bloomberg	Mutual fund hot streak has an actively managed asterisk: https://t.co/fdmfiBzJzg https://t.co/7Tl0MdlqIa
133	2017-08-08 15:05:03+00:00	Bloomberg	Managed with care, cultural diversity can become your team’s greatest asset: https://t.co/gbuChnakUr https://t.co/XYCFcNffY4
134	2017-08-08 12:19:04+00:00	Bloomberg	Chief data officers are moving from defense to offense: https://t.co/mtDPGaqRat https://t.co/eHLMh1CDKO
135	2017-08-07 14:36:29+00:00	Bloomberg	Saudi Arabia builds cities in the sand to move beyond oil: https://t.co/SjL6EIp3Sw https://t.co/eDeMqe525X
136	2017-08-04 12:12:04+00:00	Bloomberg	China's newest route for bond buying is pulling funds home: https://t.co/Bv0WDqgiH4 https://t.co/RbzvAvMf9J
137	2017-08-04 00:46:05+00:00	Bloomberg	And they're off! Runners start the Bloomberg Square Mile Relay in San Francisco. #WeRunThisCity https://t.co/jmVPD1Lh4Q
138	2017-08-03 23:57:31+00:00	Bloomberg	@atbwebb @AkiIto7 @MMCandyCheng @CarolineYLChen @RitaDevlinM @ben_elgin @hgovind_mumbai Make us proud!
139	2017-08-03 19:05:03+00:00	Bloomberg	Gender and race diversity on corporate boards – the needle is moving, but it’s moving slowly: https://t.co/FqdNABz30Q https://t.co/bYe5EFplTR
140	2017-08-03 17:28:47+00:00	Bloomberg	@RitaDevlinM T-Minus 7 hours to go!
141	2017-08-03 16:50:38+00:00	Bloomberg	What does the buy side need? Trading ‘color’: https://t.co/UEN8GKrzjD https://t.co/d448WlPc9J
142	2017-08-02 13:44:42+00:00	Bloomberg	Banks may be hit with $50 billion capital needs after Brexit: https://t.co/ZY3g5A34MP https://t.co/ONHoIUix3G
143	2017-08-01 14:18:08+00:00	Bloomberg	Has big data reached a tipping point in the cloud? https://t.co/AwakTDPOkg https://t.co/j2pn6F5ngp
144	2017-07-31 16:50:06+00:00	Bloomberg	Employee resource groups are important to an inclusive corporate culture, and should be maintained, not dismantled: https://t.co/jVZq1XOnL6 https://t.co/UDUoIhYObd
145	2017-07-31 15:43:26+00:00	Bloomberg	Good, bad and ugly of India's new national sales tax journey: https://t.co/us9xJOHzVK https://t.co/MQKMqXA2Y7
146	2017-07-28 14:33:51+00:00	Bloomberg	Gold is getting really bored with the world: https://t.co/zu8pMJNrkL https://t.co/zlVcMlFG14
147	2017-07-28 01:30:04+00:00	Bloomberg	Gender-based judgments exist in startups. Asian female founders face a whole set of unique challenges and nuances: https://t.co/liG6hXtYUT https://t.co/oxgk1T1bkx
148	2017-07-27 12:18:32+00:00	Bloomberg	How to build a soccer industry: Balls, players, China's billions https://t.co/ztZpT9JBJa https://t.co/idijLHef3t
149	2017-07-26 18:41:04+00:00	Bloomberg	Our collaborations with education nonprofits help students discover their passion and succeed in the global economy: https://t.co/hyr9o2hFUE https://t.co/1AIP9r6HLm
150	2017-07-26 17:29:50+00:00	Bloomberg	Steelmakers are worth the most in years and it's thanks to China: https://t.co/bcGAaXC6F2 https://t.co/xbdak5TcW1
151	2017-07-25 17:35:04+00:00	Bloomberg	Although 71% of organizations aspire to have inclusive cultures, only 12% meet that goal. Here's how to fix that: https://t.co/EQ9t8tEKjP https://t.co/BsQjcvW0RM
152	2017-07-25 17:01:34+00:00	Bloomberg	@trumanboyes Well, we do have plenty in the pantry :)
153	2017-07-25 13:27:23+00:00	Bloomberg	The worst of Mexico's inflation and growth struggles may be over: https://t.co/LbNl588Vmi https://t.co/xUJPKcGoR4
