Date	Title	Authors	Text
2019-02-28 09:05:57+00:00	Tron (TRX)’s Justin Sun Says The Bear Market Is Over And Binance’s Changpeng Zhao Foresees Increased Crypto Adoption	[]	"The crypto market may be finally free from the claws of the bearish trend that has been lurking around since back in 2018.

The last year has been called by many a year of correction for the market, a year which separated the valuable projects from the useless ones.

2019 is expected to be a better year regarding both prices and crypto adoption all over the world.

Things seem to be moving in the right direction so far, and Tron (TRX)’s Justin Sun believes that the bear market is finally over.

Justin Sun and Binance CEO CZ share new thoughts on the market

In an interview with the Chinese news portal Huoxing24, Sun and Binance CEO Changpeng Zhao (CZ) shared some pretty interesting thoughts on the crypto market.

Sun was asked about the future of Bitcoin and the whole industry, and he replied that BTC has already hit bottom.

He suggested that the year-long bear market has finally come to an end.

On the other hand, he doesn’t think that we’ll be experiencing any breakthrough in 2019 and he predicted that BTC’s price would remain somewhere between $3,000 and $5,000.

Sun also said that “The opportunities for market breakthroughs this year include the explosion of the dapp ecosystem, the large-scale application of the lightning network, and the three major opportunities for BitTorrent’s 100 million users to enter the cryptocurrency market.”

CZ foresees increased adoption for crypto

CZ, on the other hand, said that he is not able to predict the future of BTC or if we’ve hit bottom or not.

He believes that we’re definitely heading towards increased crypto adoption.

Samsung is the latest colossal name to support mainstream adoption. With its new flagship phone Samsung Galaxy S10 which will come with Bitcoin and crypto support, the company is encouraging the crypto mainstream adoption in more ways."
2019-01-03 19:18:25+00:00	Stocks Finally Crack the Cryptocurrency Market	['Jordan French']	"It's been a long time coming, but 2019 will finally see the cryptocurrency market make its mark on traditional finance in a tangible way.

While some will immediately point to Bitcoin futures contracts as evidence that it's already happened -- such as those offered by the CME and CBOE -- these are a simple half-measure designed to let some accredited investors and hedge funds get exposure to crypto volatility.

The real crypto market has been cut out of this equation. Cash settled futures, which represent how Bitcoin is traded on these enormous centralized exchanges, put no pressure on supply or demand for the cryptocurrency itself because at no point during the trade is any real Bitcoin changing hands.

The Jan. 7 launch of a new Nasdaq-powered crypto DX.Exchange is the biggest signifier yet that the status quo is shifting. It's not that institutional finance suddenly cares about including the cryptocurrency community, but that it has realized that cryptocurrency can aid its long-term goals for inclusive, cost-effective and cross-border asset exchange. DX.Exchange will soon offer tokenized stocks on the blockchain in a way that brings these two disparate markets together harmoniously for the first time.

Two Sides of the Same Coin

Cryptocurrency and stocks have been circling each other for years. Take the ICO fundraising model, for instance, which mimics how an IPO issues shares representing equity ownership in a public company. However, tokenholders aren't the same as shareholders and often don't enjoy the same voting rights or accountability, and regulators have already cracked down on the practice.

Additionally, during the cryptocurrency bull market of 2017, many publicly-traded stocks incorporated blockchain into their operations and even their company names, trying to capture some of the mania pushing crypto prices higher.

These are both unsustainable ideas, but not surprising considering that a two-way bridge between the crypto and equity markets is one of the last remaining hurdles for blockchain. Attempts by either market to adopt traits of or circumvent the other are equally untenable. Also, not only has cryptocurrency been shunned by the derivative crypto assets traded today, the financial industry itself now feels isolated from the great things happening in crypto.

Seeing these trends play out, some of the biggest names in traditional finance such as Bloomberg, NASDAQ and MPS Marketplace Securities have put their heads together to offer a solution.

It's coalesced in NASDAQ partner DX.Exchange, which already offers peer-to-peer trading of cryptocurrencies, but in conjunction with these venerable institutions will now be able to issue blockchain tokens that mirror the live share prices of publicly-traded companies. Not only this, but the tokens are physically-backed 1:1 by the shares they represent, so when you send Bitcoin to your DX wallet and exchange it for Facebook Token or Apple Token, for example, you've just diversified your crypto portfolio with real shares in actual companies.

How Does It Work?

An innovative stack of utility supports this simple idea and is maintained by several of the world's biggest financial firms. When a person with Bitcoin or Ethereum wishes to buy tokenized shares of stock, they can simply log in to DX.Exchange and place a buy order for the chosen shares. Simultaneously, MPS MarketPlace Securities purchases and holds the physical shares (not cash-settled futures), while issuing the appropriate number of ERC20 tokens representing the physical shares.

Following this step, tokens are handed to the buyer through DX.Exchange to fill the trade. MPS also stores these shares and adjusts its holdings based on live DX demand. The exchange of crypto-to-stocks is handled by NASDAQ's FIX (Financial Information Exchange) system, a sophisticated messaging protocol used to send and confirm transactions between parties while preventing manipulation.

A Beneficial Blending of Markets

The fact that tokens are physically backed by stocks means that demand from the crypto market for these assets will impact share prices, just as a (potentially) upcoming ETF settled in BTC would provide demand for Bitcoin and impact its price. It also means more liquidity and volume for the stock market, and the chance to trade stocks on a 24/7 basis rather than being shut out at the close.

For cryptocurrency investors and traders, it also represents an opportunity to diversify their crypto-heavy portfolios without transferring in and out of fiat, as well as store their stocks on ERC20 wallets like the Trezor or Ledger Nano S. They can also invest in stocks cross-market, meaning the ability to buy shares of companies in Tokyo as well as those in the U.S. without going through multiple difficult (and for some, impossible) permissions processes.

By far the most important concept is compliance, however. Besides working alongside NASDAQ and partnering with the Bloomberg Crypto Center, DX is also regulated by the Estonian Financial Intelligence Unit (FIU), which opens DX to EU customers who demand a regulated and fully-compliant trading experience.

We're slowly entering into an era where the internet of value is being liberated, and strangely enough, it's at the behest of those who once saw blockchain as a harbinger of evolution. As financial institutions and blockchain ideas increasingly find common ground, retail investors will find new opportunities to enjoy the emerging age of democratized finance.

The author holds stock in investment holding company, Leucadia, and is a partner in an emerging technology marketing firm, Notability Partners. He holds no positions in cryptocurrencies nor in any companies that invest in them."
2019-02-06 11:45:46+00:00	Crypto Valley: Why Switzerland is a world-leading location for blockchain companies	['Please Enter Your Name Here']	"Heinz Tännler, President of the Swiss Blockchain Federation, Government Councillor and Finance Director of the Canton of Zug, explains why Switzerland has become one of the world’s leading locations for blockchain companies

In recent years, Switzerland has become one of the world’s leading locations for blockchain companies, enabling a variety of business models to be explored here. Crypto Valley, between Zurich and Zug, is home to numerous companies and organisations in the blockchain sector. Start-ups come to Switzerland primarily because of legal certainty, Switzerland’s world-class infrastructure, and the Valley’s increasingly strong ecosystem.

Moreover, the willingness of political decision-makers to maintain and enhance Switzerland’s attractiveness for new technologies and companies, as well as the Valley’s proximity to universities has also contributed to the expansion of the sector in Switzerland.

An example of this dynamism is the establishment of the “Swiss Blockchain Federation” last October, a public-private partnership for the strengthening of blockchain technology in Switzerland. The publication of the Federal Council’s report on the optimisation of the legal basis for distributed ledger technology and blockchain in Switzerland at the end of 2018 also provided an important impetus.

Legal certainty is of great importance

Companies are in need of legal certainty, as transactions and business activities based on blockchain technology cannot always be clearly supported by the existing legislation. In order to ensure the breakthrough of the blockchain technology and the success of the companies involved, it is critical that business operate on a long-term, secure legal basis.

The publication of the report by the Federal Council marks an important step in this direction and provides a detailed survey of the legal challenges that these new business models create. The report does not call for a separate blockchain law, preferring to amend existing civil and financial market law. This reflects the objective of setting the framework conditions necessary so that Switzerland can strengthen and extend its leading position in blockchain.

Switzerland is taking a pragmatic approach, which is in line with proven Swiss principles and is to be welcomed. The Federal Council report must now be quickly followed by its legislative implementation because Switzerland needs this certainty for the basis for further development. A 10-point programme launched recently by the Swiss Blockchain Federation to strengthen blockchain technology in Switzerland also calls for a binding agenda from the regulator. The programme spells out the social policy, regulatory, and public interest issues that need to be settled if Switzerland is to be a successful blockchain location.

Excellent starting position

In comparison to other countries on the international stage, Switzerland has “excellent cards because it has good prerequisites as well as entrepreneurs, developers, scientists and doers,” said the Swiss Finance Minister Ueli Maurer on 3 December 2018 at the opening of the “Infrachain”, the first blockchain conference for the public sector and infrastructure companies in Bern, the Swiss capital.

“Blockchain applications will explode in the next few years, and Switzerland is one of the leading developers of blockchain technology and its applications,” Maurer added. This should encourage start-ups to set up their business in Switzerland.

The number of blockchain companies in Crypto Valley is growing rapidly. In December 2018, over 750 companies with over 3300 employees in Switzerland were registered on CV Maps, an online directory of the Blockchain industry. Numerous sub-sectors of the blockchain industry are represented in Crypto Valley, from HealthTech to data analytics to e-government. The 50 largest blockchain companies had a market capitalisation of around $20 billion as at the end of December 2018.

Public administrations are also using blockchain in Switzerland: The canton of Geneva is testing electronic identification and the use of digital signatures for its commercial register. Schaffhausen operates an e-government platform on blockchain in collaboration with a start-up company.

Too important not to be used

In a World Economic Forum analysis, six sources of value creation through blockchain have been identified: the simplification of internal operating procedures, more efficient interaction between regulators and supervised financial firms, the reduction of counterparty risks in transactions, time savings in the handling of financial transactions, better use of a company’s equity or liquid assets, and a greatly reduced risk of fraud. The Internet has changed the way we communicate, and blockchain is changing the way we trust each other.

The still young technology with its countless application opportunities will shape our future and is indispensable. Switzerland is determined to play a leading role as a location for successful companies.

Heinz Tännler

President of the Swiss Blockchain Federation

Government Councillor and Finance Director of the Canton of Zug

Tel: +41 41 728 36 01

Heinz.Taennler@zg.ch

www.blockchainfederation.ch

www.twitter.com/BCFederationCH"
2019-01-14 23:25:51+00:00	Tron (TRX)’s market cap is up by 40% in 2019 already	['Ali Qamar']	"The cryptocurrency market has had a terrible time since December 2017. It hit the roof on December 17th, and it’s been going down like a led balloon ever since then. The market’s value has gone down by 80%, more or less in 13 months and it’s been an unmitigated disaster for almost every blockchain project in the world.

But in the midst of the chaos that the bears have caused in crypto, two projects have managed to gain ground: Tron and Ripple. In this article, we’ll focus on Tron’s recent growth in terms of the token’s value and market capitalization.

As we write this, Tron is trading at $0.025420 which is not exactly impressive compared to Bitcoin, for instance, but only a month ago, it was at half the price. Also, although it’s trading in green numbers but can turn into the red at any time, which is not the best thing either, but many days in crypto are just like that.

Let’s focus on the parameters that really matter.

A few weeks ago, Tron was ranked 11th by market capitalization. But it’s been growing in relative value so, about a month ago, it reached the 10th position, and only a few days ago, it went to the 9th place which is the spot it currently holds.

This is quite meaningful because it means that Tronix’s market capitalization has grown by 40% since the new year began. That’s only 15 days now. And things are just getting started.

$TRX's marketcap has grown by over $500M and is UP 40% in 2019. We are only 10 DAYS into the year. More and more money will continue flowing into #Tron as new DApps continue to join the ecosystem & #ProjectAtlas comes to fruition.#TRX is just getting started! 🚦 — TRX Colony (@TronColony) January 10, 2019

Tron is barely more than a year old, and the platform’s catalog of decentralized apps is still tiny when compared to Ethereum or EOS. And yet, with that limited number of apps and use cases, it’s managed to keep growing at a rate that no other cryptocurrency can currently boast.

So what does the future hold for TRX’s price? Good news, mainly.

New dApps are being developed, and the Tron Foundation is investing a lot of money in incentivizing the community’s developers to build and deploy all kinds of new games and apps for the platform.

Some essential projects are also migrating from Ethereum and EOS to Tron because the networks are slow, expensive and troublesome. Every new app is a new use case for the token. Every new use case increases demand and trade volume which, in turn, will keep driving the price up.

And that’s nothing compared to what Project Atlas will do. Project Atlas will merge the BitTorrent network (the largest decentralized network in the world) with Tron’s blockchain, and it will reward seeding users with a Tron-based token called BitTorrent Token. We are talking about a hundred million users, located everywhere around the planet, that will become members of the Tron community (maybe unknowingly), and that will create yet another use case for the Tron-based token economy.

Tron is proliferating while most other blockchain projects are shrinking. And, as things stand, it will keep growing, and it will be much faster sooner rather than later.

So the current growth rate for Tron is nothing to be surprised. The project is useful; the community is committed, it keeps finding new use cases, more Tron-based tokens, apps and smart contracts are being issued all the time. Tron can only keep growing.

Image courtesy of PixaBay."
2019-01-08 12:31:46+00:00	The new Bitcoin? Apple, Tesla, Facebook, Amazon, Netflix, Google in blockchain trade - Is this the next big thing in the crypto world?	[]	"Even if many are still confused and find it difficult to draw an accurate trajectory for cryptocurrency star Bitcoin due to its high volatility, yet the majority would agree that blockchain world is the next big thing in the history of markets. Sure, the attention towards the blockchain market was courtesy of Bitcoin’s blockbuster performance, but there is a sudden change and its an experimental zone for traders. Who would have thought that from Bitcoin, there will be another platform as well and this would be more attractive. Yes, you have read it right, its a new reality! An exchange named as DX.Exchange is offering digital stocks apart from major cryptocurrencies like Bitcoin, Ethereum, Litecoin, Bitcoin Cash and Ripple.

To your surprise, these digital stocks are none other than major FAANG stocks namely Apple, Facebook, Netflix, Amazon, Alphabet Inc, Intel, Microsoft, and Google. If this is not enough, then one can even trade in Elon Musk’s Tesla, Baidu, and Nvidia.

DX.Exchange which is an Estonia-based crypto firm launched a trading platform for above mentioned digital stocks. In its notification, the exchange stated that users can trade digital stocks using tokens on the Ethereum blockchain platform through smart contracts.

Such is believed to bridge the gap between real world stocks using crypto and tokenized platform.

Daniel Skowronski, DX Exchange CEO says, “By tokenizing stocks of some of the biggest publicly traded companies like Google, Amazon, Facebook and more, DX is opening an untapped market of millions of old and new traders around the globe cutting out the middleman.”

In Skowronski’s view, “Tokenizing securities is the first true use case where crypto collides with the real world 24 hours a day, 7 days a week. With fractional ownership and no leverage like CFDs, these new digital stocks are a ‘more sound’ and safer investment that traders can take home in their wallet. This is the future of securities not just new issues but all the thousands of listed securities around the globe.’’

If you look at DX.Exchange trading platform, the share price of Apple, Facebook, Netflix, Tesla, Nvidia, Baidu, Microsoft and Amazon are in positive note. Not only this, their market price is higher compared to valuation on Nasdaq.

For instance, Tesla share price is at $359.06 on DX.Exchange, higher compared to $334.96 on NASDAQ on Monday. Similar is the case of other digital stocks.

Additionally, the exchange also gives estimated buy and selling price for users to place their bet.

It surely is a meet of titans on this exchange. What is the interesting situation is that digital stocks can become the next big thing in cryptocurrencies market. In fact, can even shift investors attention from Bitcoin.

Why? It’s all in the name! These digital stocks are brand in their own and have a trust due to their robust operations, reach and management. Whereas many are aware that Bitcoin is backed with unanimous investors and founder, not only this, the world is divided in two opinions for having an appetite for the digital currency. There is one section of experts including equity king Warren Buffett who sees Bitcoin and cryptocurrency as nothing but a bubble which will meet its fate.

On the other hand, there is another section of experts who believe Bitcoin is changing the phase of cryptocurrencies in the world and may change even the global financial system. There is a new history witnessed in internet technology trading platform. Bitcoin has created a new change in internet trading which has given freedom to investors.

Bitcoin became so popular that it spawned many other cryptocurrencies. In fact, it actually made a gateway for cryptocurrency markets because since its glorious days began in 2017, there are now some 2,068 cryptocurrencies present for trading with a market capitalisation of $114.11 billion.

This was not the case a year ago, as during that time Bitcoin alone had a market valuation of $326 billion.

In fact, on December 11, 2017, Bitcoin has just earmarked a level of $19,357 which was breathtaking, has even crashed to $3,500-level last year.

For instance four years ago on December 1, 2014, the price of Bitcoin stood at $957.82, if we consider this then Bitcoin gave nearly 1,921% return to its investors on December 11,2017. If we compare the performance of before 2014, then Bitcoin made many rich. It needs to be noted that, Bitcoin has also touched under $1 mark and even $10 mark between 2009 - 2013. In fact, Bitcoin has been a bubble that burst several times.

But make no mistake there is no denying that, Bitcoin is the game changer of Blockchain world.

Dr. Rajkumar S. Adukia, an author of 200 plus books and winner of National Book Honour award 2018, says, “The introduction of Crypto Currencies, specifically Bitcoin, has brought the concept of blockchain technology into the mainstream.”

Adukia explains that a blockchain is a continuously growing distributed database that protects against tampering and revision of data. One of the best things about the blockchain is that, because it is a decentralized system that exists between all permitted parties, there’s no need to pay intermediaries (Middlemen) and it saves you time and conflict.

He also accepts that Blockchains have their problems, but they are rated, undeniably, faster, cheaper, and more secure than traditional systems, which is why banks and governments are turning to them.

""Today, the acceptability of blockchain is likely to be more on the premise of open source collaboration attracting rigorous protocols and standardization. After the success of Bitcoin, all major banks and financial institutions are contemplating implementation of Blockchain by separating currency from the blockchain and using it for other inter-organisational cooperation. This can be called as second innovation in the Blockchain concept,"" said Adukia.

Simply put, it’s no more about Bitcoin, it more like a Blockchain world! Now that major FAANG stocks including Tesla, Baidu are in blockchain trade available 24X7 for trading, it would be quite interesting to see if they also create a new history just like Bitcoin. Or cruelly, take control of blockchain world."
