Date	Title	Authors	Text
2021-10-20 15:51:27+00:00	Crypto market hits $2.6 trillion capitalisation for the first time in history	['Jordan Major']	"For the first time in history, the cryptocurrency market has surpassed the $2.6 trillion barrier in terms of market capitalisation amid Bitcoin’s (BTC) rally, which soared to new all-time highs ahead of the second day of trading for the massively popular ProShares Bitcoin Strategy exchange-traded fund (ETF).

Indeed, the global crypto market cap has already reached $2.613 trillion, representing a 5.6% gain over the previous day. Furthermore, the overall market volume over the past 24 hours has increased to $94.75 billion, representing a 4% increase, according to the data from CoinMarketCap.com.

Global crypto market 1 year chart: Source: CoinMarketCap.com.

In addition, the entire volume in DeFi is now $12.07 billion, accounting for 12.74% of the total 24-hour volume in the cryptocurrency market. In contrast, the volume of all stable currencies is currently $71.81 billion, representing 75.78%.

Bitcoin sets new all-time high

Moreover, Bitcoin has helped the crypto market break through the $2.6 trillion level in terms of market capitalisation for the first time ever as the flagship digital asset hit a new all-time high on October 20, 2021, following the success of ProShares Bitcoin futures ETF trading on the stock exchange for the second day in a row.

Indeed, after a spectacular comeback from a July collapse that saw the asset fall below $30,000, the cryptocurrency has reached a new all-time high propelling the BTC into the realm of price discovery.

Consequently, BTC price movement has re-entered unknown territory after breaking over the last barrier of $64,900 set April 14, 2021. Currently, the flagship digital currency is up 7.76% in the last 24 hours and 19.56% over the previous seven days, with Bitcoin now trading above $66,800 at the time of publication.

Bitcoin 7 day price chart: Source: CoinMarketCap.com

MicroStrategy CEO Michael Saylor commented:

“Don’t bet against #Bitcoin.”

Meanwhile, renowned pseudonymous crypto trader PlanB simply tweeted:

Notably, Bitcoin appears to be following the traders stock-2-flow chart, which he earlier tweeted about back in June.

Bitcoin is below $34K, triggered by Elon Musk's energy FUD and China's mining crack down.



There is also a more fundamental reason that we see weakness in June, and possibly July. My worst case scenario for 2021 (price/on-chain based): Aug>47K, Sep>43K, Oct>63K, Nov>98K, Dec>135K pic.twitter.com/hDONOVgxH1 — PlanB (@100trillionUSD) June 20, 2021

SHIB fails to capitalise on current market momentum

Meanwhile, decentralized token Shiba Inu (SHIB), despite being the most used non-stablecoin on the Ethereum (ETH) network, is currently changing hands at $0.00002763

down 2.4% in the last 24 hours and 5.65% over the previous seven days.

Shiba Inu 7 day price chart: Source: CoinMarketCap.com

However, this is particularly notable given the fact that, apart from stablecoins, every other currency in the top 20 cryptocurrencies by market capitalisation is now trading in the green."
2021-10-18 03:44:34+00:00	Cryptocurrency updates on October 18: Bitcoin rises above $62,000; RSS calls for crypto regulation	[]	"The crypto market is trading mixed on Monday morning, with Bitcoin trading nearly 2 percent higher at $62,134. The coin has surged nearly 12 percent in the past seven days, having crossed $60,000 last Saturday. The coin is close to an all-time high as investors hoped US regulators would soon approve a futures-based exchange-traded fund (ETF), a move likely to open the path to wider investment in digital assets.

Ether , the number two coin, has also risen half a percent in the past 24 hours. While other altcoins like Binance Coin traded over 1 percent higher, Cardano and Ripple XRP declined over 1 and 3 percent, respectively.

Polkadot , on the other hand, has risen over half a percent and Dogecoin is up nearly 1 percent over the last 24 hours.

A. Top 10 cryptocurrencies by market cap

Cryptocurrency Current market price 24-hour change Bitcoin $62,132 1.45% Ether $3,865 0.40% Binance Coin $472 1.93% Cardano $2.15 -1.03% Tether $0.9996 -0.05% XRP $1.10 -2.74% Solana $161 1.32% Polkadot $42.91 1.38% USD Coin $0.9997 -0.04% Dogecoin $0.2392 1.25%

As per data from coinmarketcap.com, the crypto market's total market cap on Monday rose nearly 1 percent to $2.50 trillion. Meanwhile, Bitcoin’s dominance in the market increased 0.45 percent to 46.85 percent.

B. Cryptocurrency top news

SEC set to allow Bitcoin futures

The U.S. Securities and Exchange Commission (SEC) is set to allow the first American bitcoin futures ETF to begin trading next week, Bloomberg News reported Thursday. Such a move would open a new path for investors to gain exposure to the emerging asset, according to traders and analysts.

Bitcoin-mining power plant raises ire of environmentalists

With an aim to find a cheap energy source to mine Bitcoin, a mining operation in central New York came up with a solution to use its own power plant. However, it has alarmed environmentalists. They fear a wave of resurrected fossil-fuel plants pumping out harmful emissions is more for private profit than the public good.

Hindu group urges India to regulate cryptocurrency

A powerful right-wing Hindu group linked to BJP has called for curbs on cryptocurrencies, saying regulation was essential. ""There is a need to regularise these things for the larger good of the society,"" said Mohan Bhagwat, head of the Rashtriya Swayamsevak Sangh.

US Treasury puts crypto industry on notice

The US Treasury last Friday said suspected ransomware payments worth nearly $600 million were made in the first six months of 2021. This number was over $400 million in 2020. Seeking to stop this, Treasury said the crypto community is responsible for making sure they do not ""directly or indirectly"" help facilitate deals that are prohibited by US sanctions.

C. Top 3 trending crypto assets

Cryptocurrency Current market price 24-hour gain Lightning $0.8022 13.07% HalfPizza $0.0001789 -16.89% SIMP Token $0.00002718 -0.17%

D. Top 3 losers

Cryptocurrency Current market price 24-hour gain Aeron $0.0001343 -72% BitBall $0.00203 -68% RocketMoon $0.000000000584 -64%

E. Top 3 gainers

Cryptocurrency Current market price 24-hour loss PrinceFloki $0.000001247 2411% BitUp $0.0000008749 1375% Kombai Inu $0.000000002707 906%

(Data is sourced from coinmarketcap.com)

(With inputs from agencies)"
2021-10-27 00:00:00+00:00	Bitcoin's slide from record highs is a warning for crypto investors	['Paul R. La Monica', 'Cnn Business']	"New York (CNN Business) Only a week ago, Bitcoin hit an all-time high of nearly $67,000. But investors have been dumping the world's most valuable cryptocurrency in favor of the new kid -- or rather, new dog -- in town: shiba inu.

The price of one bitcoin fell more than 5% Wednesday and was trading around $59,000, 12% below last week's record levels. For any other asset, like a stock or bond, a drop that steep in such a short time would be considered a market correction.

For bitcoin, it's just business as usual. Crypto investors have come to accept that bitcoin is volatile.

Despite more than 13,000 cryptocurrencies listed on CoinMarketCap — ranging from dogecoin and shiba inu to more obscure tokens with even goofier names, such as Elon's Marvin, Dogelon Mars, Baby Floki Billionaire and Kitty Inu...(because cat lovers own crypto too) — bitcoin remains the dominant digital currency.

The total number of bitcoins now in circulation have a market value of $1.1 trillion. That's nearly half of the size of the entire crypto market, which is valued at $2.47 trillion."
2021-10-25 00:00:00+00:00	Cryptocurrency Market Rising at a CAGR of 11.1% to Reach USD 1902.5 Million by 2028	['Fortune Business Insights']	"Pune, India, Oct. 25, 2021 (GLOBE NEWSWIRE) -- The worldwide cryptocurrency market size is anticipated to arrive at USD 1902.5 million by 2028, displaying a CAGR of 11.1% during the estimated time frame. The market size stood at USD 826.6 million in 2020 as per a report, titled “Cryptocurrency Market Size, Share and COVID-19 Impact Analysis, By Component (Hardware, Software), By Type (Bitcoin, Ether, Litecoin, Ripple, Ether Classic, Others), By End-use (Trading, E-commerce and Retail, Peer-to-Peer Payment, and Remittance), and Regional Forecast, 2021 – 2028 ”.

Request a Sample Copy of Report: https://www.fortunebusinessinsights.com/enquiry/request-sample-pdf/cryptocurrency-market-100149

Cryptocurrency is a system of virtual currency exchange that is aimed to eliminate financial intermediaries. The developing tendency of people in created nations towards virtual cash trade strategies will immensely affect the market during the gauge time frame. The joining of blockchain innovation in cryptographic money for quick, secure, and compelling exchanges will reinforce sound development of the market in the impending years.

List of Key Players in Cryptocurrency Market:

BitGo Inc. (U.S.)

Binance, com (Malta)

Bitfury Group Limited (The Netherlands)

Coinbase (U.S.)

Coindesk.com (U.S.)

Intel Corporation (U.S.)

Ripple Labs Inc. (U.S.)

Xilinx (U.S.)

Bitmain Technologies Ltd. (Saint Bitts LLC) (China)

Report Scope & Segmentation

Report Coverage Details Forecast Period 2020 to 2028 Forecast Period 2021 to 2028 CAGR 11.1% 2028 Value Projection USD 1902.5 Million Base Year 2020 Market Size in 2020 USD 826.6 Million Historical Data for 2017 to 2019 No. of Pages 140 Segments covered Component, Type, End-use and Geography Growth Drivers Rising Popularity of Digital Currency to Augment Growth Existential Players to Promote Growth in North America Acquisitions and New Product Launches to Intensify Market Growth Pitfalls & Challenges Raging Coronavirus to Sway Market Potential





COVID-19 Impact:

Coronavirus has plummeted the growth of the financial market across the globe, including the cryptocurrency market. The level of stability in the digital currency landscape has considerably diminished. The market is attracting investments despite the uncertainty prevailing in the digital currency industry. Digital currencies like Ethereum, Bitcoin, etc., have witnessed inflation in prices despite the pandemic. Firms across several nations have paused their mining operations due to the pandemic. Some countries like Russia have delayed the deployment of cryptocurrency laws due to the pandemic.

To get to know more about the short-term and long-term impact of COVID-19 on this market, please visit: https://www.fortunebusinessinsights.com/industry-reports/cryptocurrency-market-100149

Raging Coronavirus to Sway Market Potential

The outbreak of COVID-19 has negatively impacted the global economy. The regression in the stock market has directedly created concerns for the bitcoins. For instance, 12 March 2021, the price of Bitcoin fell below USD 4,000 after a sharp decline in the S&P Index in the U.S. The market crash has incited an increase in investment capital by blockchain companies to compensate for the losses. Giant blockchain analytics, Elliptic, Chainalysis, and CipherTrace declared that they have cut-price and reduced staffs or intend to do so in the immediate future to lessen the economic effects of the coronavirus pandemic. For instance, CipherTrace has decreased the jobs of the advertising and marketing departments. Whereas Elliptic has eliminated 30% of the workers in the U.S. and the U.K and Chainalysis has planned to reduce employees' wages by 10% to mitigate the risks.

We are taking consistent endeavors to assist your business with supporting and develop during COVID-19 pandemics. In view of our experience and aptitude, we will offer you an effective investigation of Covid episodes across enterprises to assist you with setting up what's to come.

Segmentation:

Based on components, the market bifurcates into software and hardware. Based on type, the market is classified into Ether, Ether Classic, Bitcoin, Ripple, Litecoin, etc. On the basis of its end-user, the market segments into e-commerce and retail, remittance, trading, and peer-to-peer payment. Geographically, the market is categorized into North America, Asia Pacific, Europe, Latin America, and the Middle East & Africa.

Market Driver:

Rising Popularity of Digital Currency to Augment Growth

The rising pattern of cryptocurrency has prompted the acknowledgment of computerized coins like Bitcoins, Litecoins, Ethers, and the sky is the limit from there. The simple and adaptable conditional strategy offered by cryptographic money has encouraged the Central Bank Digital Currency (CBDC) movement arrangements across the world. For example, the Bank of Thailand and the Central Bank of Uruguay have applied for the tool stash to its CBDC assessment measure. The toolbox conveys a guide for the nations to gain ground rapidly and break down CBDC as a trade medium.

Moreover, the expanding interest in blockchain and cryptographic money by significant organizations will empower the rapid development of the market. For example, in October 2021, Qtum Chain Foundation, a publicly released blockchain application stage situated in Singapore reported an association with Amazon Web Services (AWS) China to convey blockchain frameworks on the AWS cloud. The organization will permit help AWS clients to utilize Amazon Machine Images (AMI) to create and distribute shrewd agreements effectively and productively.

Speak To Our Analyst: https://www.fortunebusinessinsights.com/enquiry/speak-to-analyst/cryptocurrency-market-100149

Likewise, the presentation of exceptional advanced monetary standards by prominent organizations will impact the market decidedly soon. For example, in June 2021, Facebook, Inc. declared the dispatch of advanced money named Libra. Libra will empower clients to purchase things or send cash to other people and money out Libra on the web or at basic food item shops.

Regional Insights:

Existential Players to Promote Growth in North America

The market in North America remained at USD 250.9 million out of 2021 and is anticipated to multiply in the approaching years. The development in the district is credited to the rising fame of bitcoins in the US. The presence of major famous players will cultivate development in the locale during the conjecture time frame. The Asia Pacific is required to observe critical development during the figure time frame attributable to the innovative turns of events and acknowledgment of virtual money in Japan. The developing joint efforts among central members will fundamentally support the digital money market development in the Asia Pacific. For example, in January 2021, Z Corporation, Inc. also, TaoTao, Inc. declared a joint endeavor with the monetary help office to grow its essence by affirming administrative consistency in the Japanese market.

Competitive Landscape:

Acquisitions and New Product Launches to Intensify Market Growth

The global market consists of several key players operating at regional and global levels. These giants focus on enhancing their platforms by acquisitions, partnerships, and expanding their digital infrastructures. For instance, Binance.com introduced the ‘binance cloud’ to offer digital asset exchange with security and liquidity in February 2019.

Industry Developments-

April 2020: Bitcoin.com announced a partnership with the Bit Mining company to expand its services across Japan.

November 2019: Binance.com acquired WazirX. The acquisition has enabled the adoption and production of new financial technologies to simplify access to cryptocurrency.

Quick Buy- Cryptocurrency Market Research Report: https://www.fortunebusinessinsights.com/checkout-page/100149

Major Table of Contents:

Introduction Definition, By Segment Research Approach Sources

Executive Summary

Market Dynamics Drivers, Restraints, and Opportunities Emerging Trends

Key Insights Macro and Micro Economic Indicators Consolidated SWOT Analysis of Key Players COVID-19 Impact Analysis

Global Cryptocurrency Market Analysis, Insights and Forecast, 2016 – 2027 Key Findings / Summary Market Size Estimates and Forecasts By Component (Value) Hardware FPGA ASIC GPU Others (Paper Wallet, Web Wallet, etc.) Software Mining Software Exchanges Software Wallet Payment Others (Vaults, Encryption, etc.) By Type (Value) Bitcoin Ether Litecoin Ripple Ether Classic Others (Dogecoin, Moneor, Dash, etc.) By End-use (Value) Trading E-commerce and Retail Peer-to-Peer Payment Remittance By Region (Value) North America Europe Asia Pacific Middle East and Africa Latin America



TOC Continued…!

Ask for Customization of this Report: https://www.fortunebusinessinsights.com/enquiry/customization/cryptocurrency-market-100149

Have a Look at Related Research Insights:

Blockchain Market Size, Share & COVID-19 Impact Analysis, By Component (Platform/Solution and Blockchain as a service), By Type (Public blockchain, Private blockchain), By Applications (Digital Identity Payments, Smart Contracts), By Deployment (Proof of Concept, Pilot and Production), By Industry (BFSI, Energy & Utilities, Government, Healthcare and Life Sciences, Manufacturing) and Regional Forecast, 2021-2028

3D Printing Market Size, Share & COVID-19 Impact Analysis, By Component (Hardware, Software, Services), By Technology (FDM, SLS, SLA, DMLS/SLM, Poly jet, Multi Jet Fusion, DLP, Binder Jetting, EBM, CLIP/CDLP, SDL, LOM), By Application (Prototyping, Production, Proof of Concept, Others), By End User (Automotive, Aerospace, and Defense, Healthcare, Architecture and Construction, Consumer Products, Education, Others) and Regional Forecast, 2021-2028

Patent Analytics Market Size, Share and Industry Analysis, By Component (Solutions and Services), By Services (Patent Landscapes/White Space Analysis, Patent Strategy and Management, Patent Valuation), By Enterprise Size (Large Enterprises, Small & Medium Enterprises), By Industry (IT and Telecommunications, Healthcare, Banking, Financial Services and Insurance (BFSI), Automotive), and Regional Forecast, 2020-2027

Smart Education and Learning Market Size, Share & COVID-19 Impact Analysis, By Component (Hardware, Software, Services), By Learning Mode (Collaborative Learning, Virtual Instructor Led Learning, Simulation-Based Learning, Social Learning, Blended Learning), By End User (Corporate, Academic, Government), and Regional Forecast, 2020-2027

Product Life Cycle Management Market Size, Share & Industry Analysis, By Deployment (Cloud and On-Premises), By Industry (Discrete Industry and Process Industry), and Regional Forecast, 2019-2026

About Us:

Fortune Business Insights™ delivers accurate data and innovative corporate analysis, helping organizations of all sizes make appropriate decisions. We tailor novel solutions for our clients, assisting them to address various challenges distinct to their businesses. We aim to empower them with holistic market intelligence, providing a granular overview of the market they are operating in.

Contact Us:

Fortune Business Insights™ Pvt. Ltd.

308, Supreme Headquarters,

Survey No. 36, Baner,

Pune-Bangalore Highway,

Pune - 411045, Maharashtra, India.

Phone:

US: +1 424 253 0390

UK : +44 2071 939123

APAC : +91 744 740 1245

Email: sales@fortunebusinessinsights.com

LinkedIn: https://www.linkedin.com/company/fortune-business-insights

Facebook: https://www.facebook.com/FortuneBusinessInsightsPvtLtd

Twitter: https://twitter.com/FBInsightPvtLtd"
2021-10-19 00:00:00+00:00	Love them or hate them: Cryptocurrencies are here to stay	[]	"Bitcoin has come a long way since someone or a group of someones under the name Satoshi Nakamoto wrote a paper in 2008 about how to harness computing power around the world to create a digital currency that can’t be double-spent.

Love cryptocurrencies or hate the very idea of them, they’re becoming more mainstream by the day.

Cryptocurrencies have surged so much that their total value has reached nearly $2.5 trillion, rivalling the world’s most valuable company, Apple, and have amassed more than 200 million users. At this size, it’s simply too big for the financial establishment to ignore.

Firms that cater to the world’s wealthiest families are increasingly putting some of their fortunes into crypto. Hedge funds are trading Bitcoin, which has big-name banks starting to offer them services around it. PayPal lets users buy crypto on its app, while Twitter helps people show appreciation for tweets by tipping their creators with Bitcoin.

And in the latest milestone for the industry, an easy-to-trade fund tied to Bitcoin began trading on Tuesday. Investors can buy the exchange-traded fund from ProShares through an old-school brokerage account — without having to learn what a hot or cold wallet is.

It’s all part of a movement across big businesses that see a chance to profit on the fervour around the world of crypto as a new ecosystem further builds up around it, whether they believe in it or not.

“The one thing you can say for certain is that the advent of the era of the Bitcoin ETF opens up the opportunity for Wall Street to make money on Bitcoin in a way that it hadn’t been able to previously,” said Ben Johnson, director of global ETF research at Morningstar. “The winners in all of this are the exchanges and the asset managers and the custodians. Whether investors win or not is a big, bold question mark.”

Bitcoin has come a long way since someone or a group of someones under the name Satoshi Nakamoto wrote a paper in 2008 about how to harness computing power around the world to create a digital currency that can’t be double-spent. The price has more than doubled this year alone to roughly $62,000. It was at only $635 five years ago.

Supporters of cryptocurrencies say they offer an important benefit for any investor: a price that moves independently of the economy, rather than changing with it like so many other investments. More high-minded fans say digital assets are simply the future of finance, allowing transactions to sidestep middlemen, with fees tied to a currency that’s not beholden to any government.

Critics, meanwhile, question whether crypto is just a fad. They say it uses too much energy and point to all the stiff regulatory scrutiny around it. Last month, China declared Bitcoin transactions illegal, for example. The Chair of the United States Securities and Exchange Commission Gary Gensler said in August that the world of crypto doesn’t have enough investor protection and that “it’s more like the Wild West.”

That hasn’t been enough to halt the immense momentum for crypto, as it’s gone from an online curiosity to a bigger part of the cultural and corporate landscape.

In a survey by Citi Private Bank, which manages money for wealthy people at offices around the world, roughly 23 percent said they have made some investments in crypto. Another 25 percent said they are researching it.

The growing acceptance of crypto on Wall Street has created a new crop of darlings that help people buy it. Crypto trading platform Coinbase has a market value of roughly $64bn, for example, putting it on par with such established companies as Colgate-Palmolive, FedEx and Ford Motor.

In the end though, what many on Wall Street see sticking around may not be so much Bitcoin and other cryptocurrencies, but the technology that underlies them.

Called the blockchain, it allows for a public ledger that everyone can check and trust — and many expect it to lead to a wealth of innovations. It’s akin to today’s Netflix, Facebook and other services that sprung out of the infrastructure built during the boom and bust of the dot-com bubble.

JPMorgan Chase, for example, is already using blockchain technology to improve fund transfers between global banks. That’s the same JPMorgan Chase run by CEO Jamie Dimon, who said in an interview with Axios this month that Bitcoin has “got no intrinsic value”."
2021-10-01 11:40:11+00:00	Europe is the world’s largest cryptocurrency market, controls 25% of global activity: Chainalysis Report	[]	"The world of cryptocurrencies is getting back on track in 2021 after a couple of volatile years. At the time of writing this article, the value of the global cryptocurrency market touched $2.07T, according to CoinGecko, which tracks more than 8,800 coins.

Europe: World’s largest crypto market

Image credits: Chainalysis

According to a new study by Chainalysis, Europe is the world’s largest crypto market with investment in Decentralised Finance (DeFi) driving a surge in transaction volumes."
