Date	Title	Authors	Text
2019-01-18 00:00:00+00:00	Is Crypto Volatility an Opportunity or Risk?	[]	"Although cryptocurrency markets appear to have calmed down, fluctuations are still the largest among major financial markets. The average daily movement in the last two months has been 4.1 percent.

Catalysts include regulations, system problems, stock market trends and an increase in participants and products. The market reacted the most to stock market trends, followed by system problems such as the hard fork.

Although cryptocurrency also fell as expected in mid-December when the U.S. stock market was hit by a panicked selling, there later emerged a reverse correlation where Bitcoin (BTC) was bought when U.S. equities or the U.S. dollar fell. On the other hand, the cryptocurrency market no longer reacted as much to news such as regulation reinforcement or any increase/decrease in market participants.

The current movement strongly resembles the first cryptocurrency boom and crash in 2013. At that time, prices fell 80 percent from their highs and then took a year and a half to revive. For the time being, the focus will be on monetary easing and the U.S. stock market trends, the start of BTC futures trading by the U.S. cryptocurrency exchange Bakkt, approval of the cryptocurrency ETF in the U.S. and progress of various tokenizations.

One Year after the Boom, it Seems the Market Has Stopped Moving

One year from the boom at the end of 2017, the cryptocurrency market cap is $123 billion. That’s about 80 percent below its December 2017 peak. In particular, it seems that movements have completely stopped in the two months since the drop due to Bitcoin Cash’s (BCH) hard fork (change in specifications) in mid-November (Figure 1).

However, this is because the previous range was simply to wide. Even today, cryptocurrency is still the most volatile asset, compared with other financial assets. The number of coin types has increased by more than 50 percent in one year. There are currently 2,111 types and the number continues to grow (CoinMarketCap).

The average daily fluctuation rate over the past two months is 4.1 percent, greatly exceeding even the Turkish Lira (Figure 2-1). Moreover, movement is not only in the downward direction. The maximum rate of increase was 12 percent, a similar figure to the decline of 14 percent (Figure 2-2). This rise was due to positive factors such as the release of blockchain-related products by Amazon.com (AMZN) and BCH’s hard-fork problem convergence. Moreover, in December, following the U.S. stock market selloff, there were days when cryptocurrency prices rose 5-10 percent.

Equity Swings Were the Biggest Factor Impacting the Crypto Market

Currently, what are the factors influencing the cryptocurrency market? The days of great cryptocurrency price movements were extracted, and based on the daily news flow, factors were classified as follows: regulations, system problems, stock-market trends, market participants and product increase/decrease. As seen in Figure 3, the price fluctuation range compared to the previous day for each factor was totaled (absolute value, namely, the scale of decline was also totaled as a positive number). The results show that the market responded most to the stock-market trends.

At the beginning of December, there were days when cryptocurrency declined along with stocks in a panicky risk-off mood. However, in the past one month, movements to buy cryptocurrency were conspicuous when the Dow Jones Industrial Average fell (Figure 4).

Following stock market trends, the next kind of factor moving the cryptocurrency market was system problems. Especially around this time, the BCH issue mentioned earlier and large-scale updates of Ethereum (ETH) were major factors. However, the market hardly responded to small-scale challenges such as the recent 51 percent attack on Ethereum Classic (ETC), reported by media on January 7, and the hacking of the New Zealand exchange, reported on January 16.

Regulatory news had an additional impact. For instance, BTC rose 4.5 percent when the media reported that the FSA may consider a cryptocurrency ETF on January 7. This report later proved incorrect, pushing down prices by 5.6 percent.

There was a mixed reaction to new participants and products entering the market. Some investors reacted positively to news of a booming ETH-based blockchain game. But the market remained more or less unresponsive to negative news like the contraction of China’s BTC mining giant Bitmain. This was expected to a certain extent.

What are the price catalysts now?

With prices falling this far, it is not easy to become bullish. Still, one ray of hope is the crash and revival seen after the first cryptocurrency boom before the Mt. Gox incident in 2013. As shown in Figure 5, the current cryptocurrency movement resembles the decline after the first big rally. At that time, BTC revived dramatically after sliding 80 percent from its high, and enduring a 1-1/2 year slump.

For the time being, the focus will be on the financial policies and stock market movements in the U.S. Even if the U.S. Federal Reserve stops interest-rate hikes earlier. A weak U.S. stock market could also draw money back to cryptocurrencies.

In addition, the market could see more participants and attention when Bakkt’s BTC futures begin trading. The prospect of a cryptocurrency-related ETF is another catalyst to watch. We also need to keep an eye on the trend toward tokenization. It’s become popular to sell real estate and unlisted stock in small lots via tokens. If these markets become active, cryptocurrency investors will increase and practical uses will become more clear.

Depending on how these trends play out, the revival of the cryptocurrency market is not just a dream."
2019-01-22 06:00:42+00:00	20 Cryptocurrency Reporters You Should Follow on Twitter	[]	"By stockhax

News travels fast. But it travels a heck of a lot faster when it concerns cryptocurrency.

In this fast-paced industry, keeping on top of breaking news and market movements is key if you want to succeed in beating the market. A delay of just a day could see traders miss an opportunity or lose a fortune.

There’s no better way to stay up to date than on Twitter. Make sure you never miss a breaking crypto news story again by adding these reporters to your Twitter feed.

Maria Bustillos

Maria Bustillos is a journalist and the editor of Popula.com, a news site hosted on the Ethereum-based Civil publishing platform. She also writes on Medium and has been featured in high-profile publications like The New Yorker. If you’re starting an online publication yourself, you might be interested in Bustillos piece on paying writers in crypto.

Ian DeMartino

Ian DeMartino is a technology writer and the cofounder of CoinJournal, one of the leading cryptocurrency blogs. As well as running the blog, DeMartino is still a keen contributor, posting updates several times a week. His recent piece on the boring stability of Bitcoin and what that means for the market makes for interesting reading on the changing attitudes within crypto. DeMartino is also the author of the Bitcoin Guidebook.

Alyssa Hertig

Alyssa Hertig is a writer, programmer and full-time member of CoinDesk’s editorial team. While she writes primarily about the blockchain and bitcoin technology, she holds no investments in any cryptocurrency herself. That doesn’t mean she isn’t an expert on the subject matter, though. For proof, look no further than her piece on Bitcoin’s Time Warp Attack.

Marc Hochstein

Marc Hochstein is the managing editor at CoinDesk and a former editor in chief at American Banker. Hochstein oversees the entire CoinDesk publication team but still finds time to offer his own take on the latest developments in cryptocurrency, such as this piece, which explores his attitude toward no-coiners, or people who hold no cryptocurrency.

Lily Katz

Lily Katz is a reporter at Bloomberg who covers tech, crypto, finance and real estate. Crypto and blockchain stories take up a lot of her time, and she has written on nearly every aspect of the industry. Perhaps most interesting is her coverage of the Bitcoin conference that rented out a strip club, and what that says about industry’s views of women. Incidentally, she also boasts Barack Obama on her Twitter followers list.

Jeff Kauflin

Jeff Kauflin is a staff writer at Forbes who focuses on cryptocurrencies, blockchains and fintech. His experience-backed writing (he was a marketing consultant for 10 years) has also been heavily featured in Fast Company and Entrepreneur magazine. A recent post to check out is Kauflin’s “Where Are They Now?” approach to the biggest ICOs of 2017.

Olga Kharif

Olga Kharif is a writer for Bloomberg and BusinessWeek, where she covers tech with a particular focus on crypto and the blockchains. If you want to see where the industry is heading next, check out the piece Kharif co-authored on Crypto 2.0.

Ran Neu-Ner

Ran Neu-Ner has had a wide-ranging career. He has been the CEO of Creative Counsel, South Africa’s largest advertising agency, and is the CEO and founder of OnChain Capital, a crypto investment and advisory business. Neu-Ner does his fair share of reporting, too, hosting the CNBC Africa’s Crypto Trader — a show where he seeks to provide greater information and clarity on the industry to the widest audience possible.

Diana Ngô

Diana Ngô is a freelance writer who covers everything related to the blockchain, crypto and fintech. Her writing has been featured in a number of publications such as Cointelegraph, CoinJournal, Bitcoin Magazine and ThinkLab. If you’re interested in how crypto and blockchain could impact real-world financial services, Ngô has written a great article on the topic.

Pete Rizzo

Pete Rizzo has been the editor-in-chief at CoinDesk since 2015. In his role, he oversees both the daily publication of the CoinDesk website, but also the site’s research arm, CoinDesk Research. Rizzo is a prolific writer, authoring more than 1,000 articles for the site, including this piece where Rizzo puts forward an alternative view to crypto valuations.

Salih Sarikaya

Salih Sarikaya is the founder of smartereum.com, where he is editor-in-chief. In case there wasn’t enough on his plate, Sarikaya also cofounded WhatsAround, a social platform for outdoor enthusiasts. He still contributes to the crypto conversation, predominantly by interviewing the industry’s leading influencers, such as David Gokhshtein.

Laura Shin

Laura Shin is one of the most esteemed crypto journalists, covering everything crypto and blockchain related. She’s a former senior editor at Forbes and currently hosts two blockchain-focused podcasts: Unchained and Unconfirmed. Check out her in-depth piece on the man who invented ICOs, and keep an eye out for her forthcoming book on crypto, too.

Jon Southurst

Jon Southurst is a senior editor at Bitsonline, a cryptocurrency-focused news and commentary website. Based in Japan, Southurst offers an Asian perspective on the development of the cryptocurrency industry. If you want to see what blockchain looks like in Korea, for instance, this piece by Southurst makes for excellent reading.

Kyle Torpey

Kyle Torpey has been a cryptocurrency journalist since 2014 and contributed to a string of the web’s leading publications, including Forbes, Business Insider and Bitcoin Magazine. Torpey writes exclusively about Bitcoin, making him one of the top journalistic authorities on the coin. Read Kyle’s op-ed on Weiss cryptocurrency ratings to gain an insight into his views and writing.

Aaron van Wirdum

Aaron van Wirdum is a Dutch staff writer for Bitcoin Magazine and freelance journalist who covers cryptocurrency and the blockchain. His work has been featured in some of the leading cryptocurrency news sites, including CoinDesk and Cointelegraph. Van Wirdum even found time to launch his own Dutch Bitcoin news site, Coincourant. If you want proof that van Wirdum knows his stuff, read his technical piece on some of Bitcoin’s nastiest bugs.

Oscar Williams-Grut

Oscar Williams-Grut is a UK-based senior correspondent for Yahoo Finance. Although he covers banking and finance as a whole, he has a penchant for cryptocurrency. His investigation into cryptocurrency market scams was shortlisted for the Gerald Loeb Awards 2018.

Josiah Wilmoth

Josiah Wilmoth is the assistant editor at CCN (Crypto Coins News). Wilmoth has been writing about the crypto industry since 2014 and had his articles featured in several leading publications, including Yahoo Finance, Business Insider and NPR. Wilmoth deals with every aspect of the industry, from deep dives into complicated, current topics, to easy-to-understand pieces for the wider audience, such as this excellent explanation of altcoins.

Wong Joon Ian

Wong Joon Ian is the managing director for Europe and Asia at CoinDesk. Having covered every conceivable tech topic in the past, Wong now focuses exclusively on the world of crypto. His deep dive into the lives of bitcoin miners is a must-read for anyone in the industry.

Willy Woo

Willy Woo is a cryptocurrency analyst, commentator and journalist whose writing has been featured by the likes of Forbes and CoinDesk. The vast majority of Woo’s thoughts and musings, however, can be found on his personal blog, Woobull. If you’re holding or trading several cryptocurrencies, Woo’s piece on rebalancing your portfolio is essential reading.

Joseph Young

Joseph Young is Hong Kong-based journalist, analyst and investor. He contributes primarily to Forbes, Binary District, Cointelegraph and CryptoSlate, along with other web publications. If you’re into crypto mining, check out his recent piece on the global state of the industry.

By following these reporters and analysts on Twitter, you’ll be able to get the latest cryptocurrency news as it happens. But getting the lowdown on market movements is only one part of a successful crypto strategy. You also need to make sense of the data. For that, we recommend following the top cryptocurrency traders and analysts, who are more than generous in sharing their valuable (and hopefully profitable) insights."
2019-02-28 15:45:00+00:00	PRIMER: regulating cryptocurrency exchanges	[]	"It seems there has been nothing but bad news for cryptocurrency exchanges recently.

Amid the price collapse, a number of high-profile incidents have cast further doubt on the stability of the market. Most notably, the death of Gerry Cotton, chief executive of Canadian exchange QuadrigaCX, which allegedly resulted in $145 million of investors’ money being frozen in inaccessible cold wallets. Conspiracy theories have naturally followed.

This isn’t the only case to concern potential investors. In 2014 Mt. Gox, one of the first bitcoin exchanges, shut down its operations and filed for bankruptcy. At the time, the exchange handled 70% of all bitcoin transactions, and investors are still unclear as to the state of their investment.

The plethora of hacks on exchanges around the world has had a big impact on prices, contributing to bitcoin’s collapse. Its price is now down from $19,700 in December 2017 to $2,867 at the time of writing. In September 2018, Japanese exchange Zaif was infiltrated by hackers who stole almost $60 million worth of cryptocurrency.

These high-profile incidents have led many to believe that new cryptocurrency-specific regulation is required. It is said that doing so would help protect retail investors, as well as drive out some of the less scrupulous market players.

“Regulation defining minimum standards of risk management framework would address cyber risks and information security,” said a vice president at a regtech firm. “Doing so is important to mitigate operational risks and enhance customer protection.”

See also: Coinbase CEO says crypto-specific regulation is necessary

What is regulators’ current position?

Cryptocurrency exchanges are a digital marketplace where users can trade digital cryptocurrencies.

One of the major difficulties for regulators is defining precisely what cryptocurrencies are, and the technology associated with the market. There is disagreement as to whether they should be named cryptocurrencies or cryptoassets, for instance. The distinction will affect whether these are regulated as a currency or an asset.

Regulators were initially reticent to regulate cryptocurrencies, given fears that such a move would legitimise a market they were sceptical of. Yet across the globe, many are now putting in place frameworks that will offer clear rules for market participants.

The UK, for example, is in the process of establishing a cryptocurrency framework which is expected to mirror Switzerland’s approach. The Financial Conduct Authority (FCA) published guidance in January 2019, dividing tokens into three separate categories: exchange tokens, not within FCA remit; security tokens, regulated as financial instruments; and utility tokens, which would normally escape regulation.

France is also in the process of creating its own framework. French foreign minister Bruno Le Maire said in March 2018 that he wanted his country to become the capital of ICOs. New regulation is expected imminently, which will force exchanges that conduct fiat to cryptocurrency trades to complete a registration form with the Autorité des marchés financiers.

""A growing number of jurisdictions are recognising cryptocurrencies as something they can use to promote their own financial centre,” said the regtech vice president. “They can attract new exchanges by providing a clear regulatory framework.”

Many exchanges had previously avoided fiat to cryptocurrency trades, as it would mean complying with anti-money laundering (AML) regulation. Yet to improve user convenience, more exchanges are beginning to offer these kinds of trades, even if it does mean they are subject to AML rules. This is part of an increasing trend towards more actively compliant cryptocurrency exchanges.

See also: Japan’s separate rules for crypto could be the answer

What changes are being made?

Exchanges have begun to put more emphasis on improving their security after a series of high-profile hacks on platforms. The security demands from users have risen because of an increased awareness of risks in the market. In order to be successful, exchanges need to offer a certain level of trust, and are now beginning to realise this and take active steps to address the issues.

According to Sarah Lewis, counsel at Cleary Gottlieb, to establish trust with market participants exchanges are seeking to differentiate themselves by taking into account the position of regulators. “They are acknowledging that the regulatory position may be uncertain in some jurisdictions, but also that it is evolving,” she said.

There is a risk that too much regulation could disincentivise exchanges from operating in a certain jurisdiction, and even stifle the developing industry. While opinion from governments on cryptocurrencies or cryptoassets is mixed at best, almost all are in support of blockchain. Lawmakers will not want to inhibit the industry and disrupt distributed ledger technology in their country.

New York’s Bitlicence, which businesses need before they can deal in virtual currencies, drove a number of companies out of the state. As of January this year, only 14 licences have been granted to companies. The framework has received widespread criticism for being too restrictive.

“Due to regulatory uncertainty, some crypto exchanges have taken advantage of regulatory arbitrage, and based themselves out of jurisdictions with looser regulatory oversight,” Lewis said. For example, many exchanges are based in Estonia, home to arguably the biggest money laundering scandal in history.

In order to address concerns that bitcoin has been used to launder money, the European Commission adopted the Fifth Money Laundering Directive in April 2018 to include virtual currencies. The massive fall in the bitcoin price after the directive came into force could be coincidental, but it could also be indicative of the scale of the problem before the directive came into force.

Yet legitimate exchanges wanting to conduct business honestly have a difficult task trying to adapt to different rules in different jurisdictions. The situation is also constantly evolving, making it difficult to plan for the long term.

How are exchanges reacting?

Exchanges are responding positively, however. Many are customising their offerings for a selected jurisdiction, for example only offering fiat to crypto trades in selected jurisdictions that have more generous oversight. Some are offering selected tokens in a single jurisdiction. It is clear that overall, exchanges are taking regulation into account, and making changes in response.

There is however scope for improvement, according to Fern Karsh, general counsel at fintech company Catalystic AI. “More exchanges should behave like regulated financial entities,” she said. “They should be getting ahead of regulations and implementing best practices, even in jurisdictions where regulations aren't yet in force.”

Exchanges should implement risk management programmes, run external audits and implement anti-money laundering processes. It is also important to conduct vendor due diligence and cybersecurity checks to avoid the fate of failed exchanges in recent years.

That task is likely to become easier in the coming years after clear frameworks specific to cryptocurrencies have been adopted by the major economies. While the position of regulators is becoming clearer, it is still not certain until these have been implemented. Once it is, significant legal and regulatory risk will be reduced.

This would make it easier to establish important commercial relationships and drive out exchanges with inadequate standards. This could also help to change the negative perception some have about the marketplace.

According to Karsh, the main issues exchanges have to deal with include: securing banking relationships, understanding the regulatory environment, and implementing compliant anti-money laundering practices both domestically and globally. These issues could also be reduced considerably if an effective regulatory framework is implemented.

Yet for some, it is critical that existing banking regulation is not applied.

“The major problem is that regulators are applying existing banking or securities laws,” said Angel Versetti, chief executive of blockchain company Ambrosus. “This inhibits the sector greatly. These regulations were drafted many years ago and do not account for technical developments.”

While it appears that the US is going in that direction – in light of Jay Clayton’s repeated comments that he has never seen an ICO that isn’t a security – Europe looks to be adopting new frameworks specific to the cryptocurrency industry. If it does, this would most likely be welcomed. The hope is that it would arrest the price slide plaguing the industry over the past 12 months.

See also

PRIMER: US cryptocurrency ICO regulation

Beginning of the end for crypto?

Coinbase CEO: crypto-specific regulation is necessary

EU crypto proposals could drive exchanges out of business"
