Date	Title	Authors	Text
2019-01-18 12:12:14+00:00	Can Bitcoin Recover After The Crypto Market Loss In January 2019?	['Disha Misal', 'Found A Way To Data Science', 'Ai Though Her Fascination For Technology. Likes To Read', 'Watch Football', 'Has An Enourmous Amount Affection For Astrophysics.', 'Tasmia Ansari', 'Zinnia Banerjee', 'Sreejani Bhattacharyya', 'Shraddha Goled', 'Darshan M']	"Just as the year 2019 started, the crypto market suffered a drop in its market. The volume of the crypto market dropped from $15 billion to $13 billion as the Bitcoin price fell below the $3,600 mark. There was a buzz of concern among analysts regarding the declining volume of digital assets and concerned regarding the potential fall of cryptocurrencies without significant sell pressure from bears.

Generally, at least until digital currencies overcome the last phase of a 12-month long bear market and start a strong accumulation phase, traders and investors in the space of digital currency expect a year free of volatility. Most digital currencies are envisioned by the traders in a low price range.

THE BELAMY Sign up for your weekly dose of what's up in emerging technology. Email Sign up

What Do Experts Have To Say?

Bitcoin, along with other cryptocurrencies, has driven a wave of panic among the investors. Mitch Blakeway, Head of Trading at Quantatex said, “Despite Bitcoin’s fairly limited use cases, and even though its technology may be less sophisticated when compared to some other projects, it will likely continue to remain the market leader in 2019. Bitcoin still has the reputation and the liquidity that make it preferable to other cryptos.”

Bitcoin had approached this low value earlier in December the last year as well and had had a sharp recovery soon after that. Now with its drop to $3,000 region, it may again initiate a sharp recovery with the aid of big buy walls on major cryptocurrency-to-fiat exchanges.

Considering the lack of momentum of cryptocurrencies and the inability of dominant digital assets in the likes of Bitcoin and Ethereum to breakout of important resistance levels, cryptocurrency technical analyst DonAlt had suggested that 2019 may turn out to be a boring and a low volatile year.

“I’ve been relatively inactive this year – for one reason – there just hasn’t been too much to trade. I wouldn’t be surprised if 2019 plays out like this, boring, choppy and frustrating to trade. The worst thing you can do is force trades when your system doesn’t give you any,” the analyst said.

Cryptocurrency trader Josh Rager tweeted:

https://twitter.com/Josh_Rager/status/1084141684978536449

Will Bitcoin Recover?

Many crypto enthusiasts are positive about the market of cryptocurrency. Slowly many people are realising how cryptocurrencies work and how they are going to benefit them by involving in them and hence people will continue to invest in Bitcoin. The downfall of Bitcoin and others in the industry as well has happened several times before this. Bitcoin had fell to its lowest price in over a year in November last year, which pushed the prices of other major coins down as well. In just 12 hours, the overall cryptocurrency market cap had fallen from $210 billion to $183 billion, losing $27 billion in the process. In November last year.

Way Ahead

If Bitcoin continues to fall below $3,500 and possibly to its 12-month low at $3,122, cryptocurrencies with low market caps and daily volumes are expected to experience intensified downward price movements against both Bitcoin and the US dollar.

There has been speculation among analysts regarding the peaks of the crypto. It remains to be seen whether Bitcoin will indeed be able to rise to $40,000 in the current calendar year or not.

The blockchain of Ethereum (ETH) is one of the most useful in the blockchain space, after Bitcoin. A recent analysis of the charts suggests a sharp drop in the price of ETH and the rate of its fall is much higher than the other assets. This downfall has had the investors surprised and is a matter of concern looking at where the digital asset is heading. Tron, a coin that its Chinese founder hopes will challenge the world’s major content providers, such as Facebook and YouTube has also begun to drop its value.

On the other hand, for the cryptocurrency giant Ripple, the bulls have been unable to push Ripple (XRP) above $0.33108. Currently, the bulls are attempting to scale the level again. If this latest recovery attempt fails, a cryptocurrency to drop to $0.27795 is expected.

This downfall could be because of the security loopholes in the finance ecosystem. These attributes have to be given importance for a constant recovery of the crypto market.

How The Crypto Sell Will Help Taxes

Right from Google’s ban on cryptocurrency related ads, the Bitcoin prices have run to an all month low. The volatile cryptocurrency fell by $500 within a six-hour space. If Bitcoin has been purchased and sold within the same year, the person will be taxed on short-term capital gains.

How Will This Affect India?

Cryptocurrencies like Bitcoin are banned in India, but this drop in the crypto market might still affect the country since the second interdisciplinary committee is in favour of legalising it. With more strict rules, this news brings hopes for the cryptocurrencies to enter the Indian market right back. The committee had previously met twice, but there were still ongoing deliberations surrounding it.

“We have already had two meetings. There is a general consensus that cryptocurrency cannot be dismissed as completely illegal. It needs to be legalised with strong riders. Deliberations are on. We will have more clarity soon,” a senior official said. The committee has met twice on the issue and is likely to submit its report to the finance ministry by February 2019."
2019-01-10 00:00:00+00:00	Bitcoin stumbles below $4,000 in sudden overnight drop	['Kate Rooney']	"Bitcoin's struggles are continuing into 2019.

The world's largest cryptocurrency dropped 9 percent on Thursday morning to a low of $3,570.29, according to industry data site CoinDesk. The sudden and sharp drop brings bitcoin's one-year losses to more than 70 percent.

Other major cryptocurrencies struggled, too. Ether fell 15 percent while XRP dropped 9 percent, according to CoinDesk.

Analysts did not point to any particular catalyst for Thursday's cryptocurrency dip. Mati Greenspan, senior market analyst at eToro, said clients had been asking — but there doesn't seem to be any real reason for this drop, ""neither technical nor fundamental.""

""The one interesting thing about this movement is that it seems to be an exact reversal of the surge that happened on Sunday afternoon,"" Greenspan said. ""At this point, the gains made since the start of the year have now been reversed and we're back to a neutral 2019.""

Bitcoin and other cryptocurrencies have failed to recover to their peaks reached around this time last year. The retail mania has certainly worn off as the entire market capitalization has dropped 85 percent in a year, according to Coinmarketcap.com.

Investors had been awaiting more institutional adoption this year, and the launch of a series of bitcoin futures. Both the Intercontinental Exchange, or ICE (parent company of the New York Stock Exchange) and the Nasdaq plan to launch bitcoin futures this year, despite the ongoing bear market.

So far, the Commodity Futures Trading Commission, which regulates bitcoin, has approved two crypto futures products — one from the Chicago Board Options Exchange and another by the Chicago Mercantile Exchange. Still, SEC Chairman Jay Clayton said in November that he needs to see better custody solutions surveillance before he would feel ""comfortable"" allowing a crypto exchange traded fund, or ETF, to come to market.

WATCH: The crypto craze ended 2018 with a whimper"
2019-01-28 04:00:35+00:00	Bitcoin Price Struggles As Crypto Market Cap Nears $100 Billion Support	[]	"Bitcoin price fell 3 percent to lose support at $3500 January 28, abruptly ending a week in which volatility hit its lowest levels in over two months.

Bitcoin Price Struggling Amid Low Volatility

Data from Coinmarketcap showed the knock-on effect of Bitcoin (BTC) aiming downwards Monday, with altcoins in the top twenty cryptocurrencies by market cap repeating the losses.

Ethereum (ETH) was down 7 percent at press time, just behind the worst performers such as Bitcoin Cash (BCH), which fell 10 percent.

The overall cryptocurrency market cap has declined to $114 billion, its smallest since mid-December.

Monday’s events spelled the end of a peaceful week for traders, with Bitcoin’s expected average volatility expected at around 3.5 percent daily.

Bitcoin Closes in On 350th ‘Death’

Analysts continue to await the end of the protracted bear market, which has characterized Bitcoin since December 2017. Price forecasts for 2019 put the largest cryptocurrency anywhere from plugging lows of $1300 to setting new all-time highs above $20,000.

“We’ve been in a bear market for a very long stretch, probably the longest in history for Bitcoin right now […] I think right now my personal view is that we are actually overshooting on the lower side now,” exchange Binance CEO Changpeng Zhao told a conference last week.

January 26 marked the three-year anniversary of one of Bitcoin’s best-known ‘obituaries.’ Coming from ex-developer Mike Hearn, the 2016 blog post describes Bitcoin as “failed.” At the time, BTC/USD traded at $310.

“It has failed because the community has failed,” he concluded.

Since then, Bitcoin has chalked up a total of 342 such ‘obituaries,’ with 91 deaths in 2018 alone. This year, however, only three have appeared in January since the date of its tenth anniversary.

What do you think about Bitcoin price this week? Let us know in the comments section below!

Images courtesy of Shutterstock"
2019-02-05 09:19:54+00:00	7 simple tips to better understand cryptocurrency market data	['Lucas Miller', 'Story By']	"Lucas Miller is the founder of Echelon Copy, a digital media agency headquartered in Orem, Utah that helps brands improve their online prese (show all) Lucas Miller is the founder of Echelon Copy, a digital media agency headquartered in Orem, Utah that helps brands improve their online presence.

2018 was a wild ride for cryptocurrencies. Despite the many ups and downs experienced by Bitcoin and other major cryptocurrency vendors, the market has proven that it is going to stick around for the long haul.

Though there is still risk involved in cryptocurrency, investors are coming to better understand the challenges and opportunities associated with this exciting sector. As a result, more people are entering the crypto trading sphere than ever before.

If you’re still new to the crypto investing scene, however, the sheer number of investing options — and new terminology — can feel overwhelming. By taking steps to better understand what you’re getting into, you will make wiser investment decisions.

Here are some tips to get you started on the right track:

1) Know the relation between market cap and circulating supply

New cryptocurrency investors may be intimidated by the new vocabulary they need to learn and how these different terms affect pricing. For example, the “market cap” for a particular coin is used to determine the total value of coins on the market. This number is determined by multiplying the coin’s circulating supply by its current price.

The use of the circulating supply, rather than the total supply, is an important distinction. For a variety of reasons, some coins are not available on the public market. Because they aren’t available for trading, they are not counted toward price considerations or the market cap.

2) Keep up with current market conditions

You can read articles debating the pros and cons of various cryptocurrencies, but current market data will always be the most reliable source for identifying trends and making smarter trading decisions.

Fortunately, there are several websites dedicated to providing up-to-the-minute updates regarding changes in price, supply and market cap. Coincap, CoinMarketCap, and CryptoCompare are just a few examples of resources that help investors stay up to date on current prices. Data that is updated in real-time is paired with charts tracking changes over 24-hour and seven-day periods to give investors a better idea of current trends.

3) Follow the leaders

Even when you have real-time data available, making a trading decision based on a “top 100 cryptocurrencies” list can be intimidating.

However, when this data is paired with guidance from top investors, you can have greater confidence in your decisions and even learn a few extra pointers along the way.

Sites like eToro utilize what is known as a “social trading” program that allows top investors to share their knowledge and trading practices.

New investors can use these traders as a guiding reference or even fully match their investment strategies as they learn the ropes. Picking up good habits early on in your investing journey will keep you from making the impulsive decisions that can lead to disaster.

4) Diversification is vital for success

As with traditional investment opportunities, diversification is essential if you wish to come out a financial winner in cryptocurrencies. With a more diversified portfolio, you reduce your overall risk, especially if you invest in coins and tokens that service different sectors.

This also means you should continue to invest in non-crypto spheres. These practices maximize your potential return while alleviating the risk should a particular coin or stock go under.

You can keep your coins organized and protected with a cryptocurrency wallet. These digital wallets serve as a centralized hub for receiving and sending crypto transactions. Keeping your diversified investments locked in a secure wallet will make it easier to keep track of your investments.

5) Understand which factors influence pricing

What causes cryptocurrency prices to rise and fall? Though supply and demand certainly play a role, crypto investors should carefully consider the perceived utility of a cryptocurrency. If a coin is perceived as having several practical applications, it will be more highly sought-after, and therefore, increase in price.

As MyCryptopedia explains, mining difficulty is another major factor that affects pricing: “A higher mining difficulty means that it is harder to mine an additional unit of a coin. This can have an impact on a coin’s perceived value, and subsequently, its price, as increasing a coin’s supply will require more computing power to be used in the mining process.”

Savvy investors should also pay attention to news headlines regarding different coins and tokens. Positive or negative articles will often have a direct correlation on future pricing trends.

6) Research individual coins and tokens

Cryptocurrencies have frequently been called out as nothing more than a scam by skeptical individuals. While many crypto products have proven themselves to be worthwhile investments, other tokens and coins have indeed been scams, some of which have cost investors millions of dollars.

While this isn’t much of a risk with any of the major, better-known cryptocurrencies, anyone considering investing in a new coin or token should do thorough research before making a trade.

By understanding how a coin will operate within the market, you can determine whether or not it is a legitimate opportunity — and if it is legitimate, you can likely identify whether it will actually be a good investment.

In addition to researching market news, resources like All Crypto Whitepapers can greatly assist your investigative efforts. This site collects all documents highlighting cryptocurrencies’ technical details, marketing plans and more so you can better understand what they have to offer.

7) Prepare for volatility

No one can predict what the market will do with 100 percent accuracy — and this is perhaps truer of cryptocurrency than any other investment sector. Panicking over day to day changes in the market value won’t do you much good. You’re more likely to rush into an impulsive decision and make a trade you’ll later regret.

The stock market provides valuable lessons for handling this volatility, as global stock markets are no stranger to sudden rises and falls in pricing. As such, many traditional lessons and tips for handling volatility are just as applicable to crypto investors.

Many of these practices highlight the value of long-term investments by focusing on a future reward rather than daily price fluctuations. Even short-term investors need to exercise a bit of patience and look at the bigger picture. Understanding that volatility is part of crypto investing, but that you should still experience great growth in the long run, will help you make wiser decisions.

Cryptocurrency trading is expected to increase by 50 percent in 2019 alone.

Despite the seemingly never-ending claims that crypto is a “fad” or already dead, it is clear that this investment option is here to stay. By becoming an informed investor now, you can stay ahead of the curve and be better prepared for future market shifts."
2019-02-21 10:27:00+00:00	Why News of JPM Coin Resulted in Bitcoin (BTC) Gaining in the Crypto Markets	[]	"ethereumworldnews.com Reading time: ~3 m

On Valentines day, crypto traders and enthusiasts woke up to news that the biggest bank in the United States, JP Morgan Chase, will be issuing its own cryptocurrency known as the ‘JPM Coin’. The digital asset will be an internal cryptocurrency used to ease the flow of payments by the bank by instantly settling transactions between clients of its wholesale payments business.

Bloomberg Reports that the Current Bitcoin Rally Was due to the JPM Coin Announcement

5 days later, and on the 19th of February, Bloomberg reported that the recent gains by BTC from $3,600 levels to its current value of around $3,900 was a delayed response frto the news of JP Morgan launching its own cryptocurrency. The Bloomberg report stated the following:

Bitcoin is approaching $4,000 for the first time since the start of the year, as the largest cryptocurrency gets a delayed boost from the announcement last week that JPMorgan has developed a prototype digital coin that it plans to use to speed up payments between corporate customers.

Immediate Backlash from Crypto Twitter

As soon as Bloomberg tweeted the news, crypto enthusiasts responded by ridiculing the report. One user went as far as claiming the report was fake news. The tweet can be found below.

Perfect example of … Fake News — Mr Coins ⚡️ (@CryptoDabbler) February 19, 2019

JP Morgan Launching a Crypto Legitimizes Bitcoin

According to the Abacus Journal, news of JP Morgan launching a cryptocurrency brought renewed interest in the investment of Bitcoin. Proof of this can be seen with the CME Group reporting a record number of Bitcoin futures contracts traded on the 19th of February.

One hedge fund source told Abacus Journal the following.

Every adult with a bank account and a job knows who JP Morgan is. So the announcement of a native cryptocurrency brought interest to a renewed and fresh level that had been diminished throughout nearly all of 2018. My wife even asked me about it the day after it was announced. The huge bounce in volumes in Bitcoin and, for example, Bitcoin futures at the CME are indicative of the wave the announcement caused.

Another source was quick to predict that the JPM Coin might be the catalyst the crypto markets needed to bounce back.

It isn’t that far fetched to foresee a look back in six months and point to the $JPM coin as the catalyst that busted the bear market. Sentiment and narrative play a huge role in what remains a pretty small markets at this point. The JP Morgan news pushed prices higher across the board and those price increases were seriously validated by a surge in volumes.

Summing it Up

Many crypto enthusiasts were quick to dismiss the Bloomberg report that the current increment in value of Bitcoin to near $4,000 levels was a delayed response of the news that JP Morgan was launching its own cryptocurrency. However, with news of a record day of trading for CME’s Bitcoin futures on the 19th of this month, and the input of hedge fund sources to the Abacus Journal, it is worth concluding that the JPM Coin might just have catalyzed renewed investor interest in BTC and other cryptocurrencies.

What are your thoughts on the idea that news of JP Morgan launching their own cryptocurrency is the reason we are seeing Bitcoin (BTC) and all our favorite digital assets gaining in the markets? Does JPM Coin legitimize cryptocurrencies as viable investments? Please let us know in the comment section below.

[Feature image courtesy of Pixabay.com]

Disclaimer: This article is not meant to give financial advice. Any additional opinion herein is purely the author’s and does not represent the opinion of Ethereum World News or any of its other writers. Please carry out your own research before investing in any of the numerous cryptocurrencies available. Thank you."
