Date	Title	Authors	Text
2021-10-18 00:00:00+00:00	Is Zillow stock a buy or sell as it pauses home-flipping service to clear backlog?	[]	"Md Motiur is a Market Analyst at Invezz covering the North American, European, and Asian stock markets. He has… read more

On Monday, Zillow Group Inc. (NASDAQ:ZG) shares declined by 9% after the company said it won’t be buying more houses after reaching capacity for the year. Zillow is pausing its property-flipping services amid a growing backlog of unrenovated homes.

The company is facing shortages of workers used to fix up the property amid rising demand for Zillow Offers. As a result, it has paused new purchases until it can find a solution for the backlog.

Are you looking for fast-news, hot-tips and market analysis? Sign-up for the Invezz newsletter, today.

A Zillow spokesperson wrote in an email:

We are beyond operational capacity in our Zillow Offers business and are not taking on additional contracts to purchase homes at this time.

Investors fear the company could lose a significant share of the year-end business to its close peer, Opendoor Technologies Inc. (BMV:OPEN1).

Is it too late to sell ZG shares?

From an investment perspective, Zillow shares trade at steep trailing 12-month and forward P/E ratios of 158.22 and 78.91, respectively. As a result, value investors may opt for alternatives in the market.

However, with analysts expecting earnings to grow by more than 51% this year before rising at an average annual rate of 73.50% over the next five years, its growth prospects look exciting.

Therefore, investors willing to overlook short-term turbulence could find it as a compelling option for the portfolios.

Source – TradingView

Technically, Zillow shares seem to be trading within a descending channel formation in the intraday chart. In addition, the stock pulled back sharply on Monday, pushing the stock closer to oversold conditions.

Therefore, given ZG’s exciting growth prospects, long-term investors could choose to capitalise on the pullback by targeting profits at about $96.22, or higher at $111.77.

On the other hand, $73.32 and $55.88 are crucial support zones.

It could be time to buy

In summary, although Zillow shares trade at steep valuation multiples, its long-term growth prospects outweigh short-term risks.

Therefore, with shares pulling back sharply on Monday, it could be a perfect opportunity to invest in ZG stock.

Where to buy right now

To invest simply and easily, users need a low-fee broker with a track record of reliability. The following brokers are highly rated, recognised worldwide, and safe to use:

Etoro, trusted by over 13m users worldwide. Register here > Capital.com, simple, easy to use and regulated. Register here >

*Cryptoasset investing is unregulated in some EU countries and the UK. No consumer protection. Your capital is at risk."
2021-10-10 14:00:00+00:00	Taking Actions On Your Ideas	['Kellie Williams']	"We got interactive in our latest SE session and asked you to bring your ideas to the stage and discuss what stage you’re at with your startup. Is it just an idea? Have you done the research, or are you in the running to start the production? We hear from Colin and Michele, who tell us their ‘ideas to action’ process and gain a fundamental understanding of how entrepreneurs all follow the same process.

The beginning

The first thing Colin does when an idea sparks to mind is head over to godaddy.com to ensure he has ownership of his idea and domain name.

Michele does in-depth research on her idea to see if the domain name is available and establishes whether the patent has already been taken.

Michele said it is critically important to pick your domain name. “Picking a name really helps you to focus on your idea.”

Following this, Michele does a scan across all social media platforms to see if her domain name is available.

Stage gates

Colin likes to set up ‘stage gates’ so that he is able to visualize a company a certain size. A type of deadline to reach, a goal to achieve, what is doable, and what is not. He said, “If I cannot reach those stage gates, I either need to pivot or get out of that business.”

Do you fall in love with company and business ideas and find yourself holding on for too long? Colin said it’s time to stop, and knowing when to let go is crucial to you preventing yourself from losing time and money; this is the benefit of stage gates.

Is the business scalable?

It is easy to get excited about something in the short term, but is your business idea longstanding? Does it have legs? Can it grow, and can you be working on this business for the next 10 to 15 years?

Michele gets hung up on her next big idea and says it is essential to recognize that it is “highly improbable” to always come up with ideas that will be successful and the next “big thing.” So, that is why considering whether a company is scalable is a beneficial tool to help you focus on building a company rather than hitting the jackpot.

Fundraising

Funding is typically one of the most difficult stages of the ‘ideas to action’ process. Colin recommends using your own personal or family money to get your idea off the ground until you can prove a concept. Once you’ve proven a concept, it’s much easier to raise funding.

There are funding opportunities within government funding schemes. Don’t be ashamed to turn to the government for a helping hand in your startup if you need to.

Facebook and Google also offer free advertising, a great way to get your foot in the door!

Crowdfunding is a whole other conversation; “crowdfunding needs a marketing engine ready to fuel your kickstart business,” said Michele.

Production

The next stage is production; how do you bring your product to fruition? If you’ve got the money and the go-ahead, what next?

Michele said figuring out “how to acquire a valued customer” is a popular way to help your micro company reach its potential. Is the market responding to your product? Is it a design flaw? What are the competitors like? How big is the market you’re trying to get into? Find out the challenges in the market and face them head-on.

Listen to the full session above and get more insights from entrepreneurs."
