Date	Title	Authors	Text
2018-12-23 13:00:00+00:00	Cryptocurrency News: Write About (and Get Paid) in Digital Currency	[]	"Ever wonder if the latest cryptocurrency news has anything to do with freelance writing?

Well, there’s a handful of niche magazines and millions of webpages dedicated to covering cryptocurrency news, bitcoin trading, and digital currencies.

If you’re already writing about the intersection of finance and technology, you’re probably at least familiar with cryptocurrency.

But if you need proof cryptocurrency is a real thing, here’s just one example. There’s a $325 million luxury resort under development in Dubai, and investors are funding the project in bitcoin.

If you’re looking for a niche, there’s a growing demand for cryptocurrency news you can write about.

But it’s also a new way to get paid. In a recent survey of 1,100 freelancers, 29 percent said they prefer to be paid in cryptocurrency.

Want to learn how to tap into this niche and get paid in digital currency? Here’s what you need to know.

Bitcoin basics for freelance writers

Cryptocurrencies are a type of digital currency whose value is derived from their usefulness. Remember the law of supply and demand from economics class?

Some cryptocurrencies have no purpose at all, which makes them extremely risky. Others, like Bitcoin, have a proven usefulness and a track record of increasing value.

A crash-course in blockchain technology

Stay with me, OK. The underlying technology for cryptocurrencies is called blockchain. Here’s a simple explanation of how it works:

Each cryptocurrency is created in a block, and organized in a chain based on a specific set of rules

It all happens in the digital universe using complex software coupled with super-strong cryptographic security measures.

And there’s more than one blockchain and cryptocurrency. There are more than 800 digital coins including Bitcoin, Steem, Ripple, Ethereum, Stellar, and many more.

This concludes today’s lecture. Clear as mud? This primer and this diagram should give you a basic understanding of how cryptocurrency technology works as a payment system.

Note: If you want to write about cyrptocurrency news, or accept digital currency payments from clients, do your homework.

The cryptocurrency opportunity for freelance writers

If you established yourself as a web copywriter in 1995, there were fewer than 30,000 websites. If you started back then, achieving expert status as a highly-sought-after copywriter would have been easier.

Why? By 2005, when there were over 64 million websites and far more freelance writers hustling for clients. Getting an early start would have benefited you in at least three ways:

You’d have been seen as a pioneer in website content writing As one of the first to establish yourself as a professional online content writer, you’d have been able to charge top dollar for your services You would have had such insight into writing online content that you could see easily where the Internet was headed and quickly adapt to position yourself as a specialist in the most lucrative online niches

Today’s blockchain and cryptocurrency industries are like the Internet of 1995, which is to say nascent and rife with opportunity.

Of course, with massive opportunity comes massive risk. So I’ll warn you that you should do your due diligence and study the market and the latest cryptocurrency news before jumping in. Still, I’m confident that the current market is a huge opportunity for freelance writers.

Get paid in cryptocurrency for freelance work

Want to get paid in cryptocurrency for freelance work? Chances are pretty good, your client will explain this up front. And there’s one big reason you should consider it: faster payments for international clients.

If you’re a freelancer in the U.S., and have a client outside the country, the current cross-border payments system doesn’t always work in your favor. Banks can take days to verify payment.

The cryptocurrency advantage: You can bill a freelance writing client in a foreign country and receive your payment within minutes with no intermediary. This is very valuable if you do a lot of business in foreign countries.

If you want to accept cryptocurrency as payment, there’s a few terms you’ll need to know:

Crypto wallet. To accept cryptocurrency as payment, you must have a crypto wallet. Think of it like a physical wallet designed for holding digital currencies like Bitcoin. And there’s more than one kind of crypto wallet depending on how you plan to use the funds from freelance work. If you’re just starting out, set up your crypto wallet with Coinbase.

To accept cryptocurrency as payment, you must have a crypto wallet. Think of it like a physical wallet designed for holding digital currencies like Bitcoin. And there’s more than one kind of crypto wallet depending on how you plan to use the funds from freelance work. If you’re just starting out, set up your crypto wallet with Coinbase. Content vesting. This involves accepting a native cryptocurrency for a project either as payment for services or as a reward for participation. For example, Steemit pays curation rewards for blog posts, comments, and upvotes. I’ve been active on the site since March 2018 and have earned hundreds of dollars in curation rewards. I’ve also accepted payment in STEEM for writing about cryptocurrency news, and then republished those articles at Trybe and Medium for additional rewards.

Find writing jobs in cryptocurrency

Ready to jump into writing about cryptocurrency? You might be surprised to know that it touches nearly every freelance writing niche and industry, including:

Travel and entertainment

Supply chain systems

Financial services

Law

Healthcare, and more.

If you want to find freelance clients in your niche to write about cryptocurrency, use these resources to identify potential clients, marketing directors and decision makers, and info to vet your prospects:

Crunchbase . This database of business info shows you fundraising activities, CB Rank, size of company, and other useful information of high tech companies. Coinbase, for example, recently raised $300 million in a Series E late stage funding round. Bitmain, the world’s largest cryptocurrency mining company, has over 100 employees and has raised a total of $764.7 million in three funding rounds.

. This database of business info shows you fundraising activities, CB Rank, size of company, and other useful information of high tech companies. Coinbase, for example, recently raised $300 million in a Series E late stage funding round. Bitmain, the world’s largest cryptocurrency mining company, has over 100 employees and has raised a total of $764.7 million in three funding rounds. CoinMarketCap , which lists cryptocurrencies ranked by market capitalization. You can easily view historical data on each currency with charts, links to websites, the source code on Github, and other technical documentation. CoinMarketCap also has a section set aside for cryptocurrency exchanges.

, which lists cryptocurrencies ranked by market capitalization. You can easily view historical data on each currency with charts, links to websites, the source code on Github, and other technical documentation. CoinMarketCap also has a section set aside for cryptocurrency exchanges. ETHLance. The cryptocurrency Ethereum blockchain has a marketplace for freelance projects. You’ll need the MetaMask browser extension as your wallet to use it.

Is cryptocurrency a lucrative niche for freelance writers?

It is if you want to write for Fortune 500 companies about rapidly developing digital currencies.

For example, all the major global consulting companies—IBM, Accenture, Deloitte, Cisco, McKinsey, PwC, etc.—are spending billions of dollars on blockchain development. And the top companies in virtually every industry are testing distributed ledger and blockchain technology for all kinds of practical use cases.

There is no guarantee this testing will catapult the technology into the mainstream, but the current opportunity for freelance writers to cash in on this niche is significant.

Define your niche to reap rewards

In an emerging market or industry with billions in revenue potential, the cryptocurrency culture is also rife with scams. Some crypto exchanges have been hacked resulting in losses of millions of dollars in digital money.

But based on cryptocurrency news and trends, it appears this fin-tech niche will likely stabilize. And that means more great opportunities for freelance writers.

This is an industry still seeking its way, but now is a great time to dig in and establish yourself as the writer for cryptocurrency publications and copywriting clients.

Want to write about or get paid in cryptocurrency? Let’s discuss on Facebook or LinkedIn.

Allen Taylor is a former newspaper editor turned content strategist. He specializes in writing about FinTech and next-generation technology."
2018-05-26 14:13:00+00:00	Cryptocurrency Growth Trends & Industry Performance	[]	"This report is part of a series covering cryptocurrency investing. This is not meant to be investment advice, but covers some of the performance, trends, opportunities and future of cryptocurrency.

With the total number of cryptocurrencies and digital assets on exchanges skyrocketing from 617 to 1,335 over the course of the year, 2017 has been dubbed the “year of the cryptocurrency.”[i] The market capitalization, investor appetite, and institutional coverage for cryptocurrencies have all jumped exponentially. This article will focus on the recent performance of the cryptocurrency industry, key factors driving and restraining growth, and its outlook over the next five years.

Industry Performance

Market Size & Volatility

Estimating the exact market size can be difficult of any industry, but particularly the cryptocurrency industry due to the massive volatility in prices over short periods of time. As of December 1, 2017, the total market capitalization of the cryptocurrency market was $326.7B. By January 1 of this year, the cryptocurrency market cap had increased to $629.5B. At the writing of this article (February 28, 2018), the market cap settled at $447.9B.[ii]

Source: SIFR

The volatility of the crypto market spent all of 2017 above 80% annualized volatility level with a large portion of the year consistently above 100% volatility and peaking in February 2018 at 148% volatility.[iii] These extremely high levels are unheard for assets traded in volumes as high as cryptocurrencies in 2017. They are also especially high when compared to the rest of the US stock market, which in 2017 experienced one of the least volatile years on record.[iv]

Astronomical Growth Rates

In 2017, the cryptocurrency industry saw record-breaking growth rates in the number of market participants and market capitalization. The total number of cryptocurrencies and digital assets on exchanges soared by 216%, from 617 to 1,335, and currently stands at 1,531.[v][vi] Total market capitalization increased by 3,363% in 2017, with Bitcoin’s market cap jumping 1,364% and the Altcoin side shooting 16,695%.[vii] Altcoin describes all cryptocurrencies or digital assets other than Bitcoin.

Source: CoinSpeaker

Record growth in prices of the Top 10 cryptocurrencies by capitalization during 2017 (USD), %.

The majority of analysts are bullish on the continued growth of the crypto market, although it is difficult to form any consensus about growth rates. Because of its vast application and advantages to traditional currencies, most analysts agree that the growth in the crypto market seen thus far is only the beginning of a long exponential curve.[viii] The highest estimates from bullish investors put the 2018 total market cap of crypto assets at $2T[ix], and the Bitcoin price at $1M by 2020.[x] More conservative estimates still predict a bitcoin price of $100,000 by 2022.[xi]

ICO’s

Initial Coin Offerings (ICO) are a new kind of financial transaction, used to raise funds for a new cryptocurrency or other digital asset. Investors pay using cash or another cryptocurrency and are given a percentage of the new cryptocurrency in return. As cryptocurrencies become a more stable asset class, ICO’s are becoming a popular means of raising money and avoiding the arduous regulation surrounding the capital raising process.[xii]

ICO Market, Funds Invested & Number of ICO’s, 2017

Source: CoinSpeaker

In 2017, as the number of cryptocurrencies more than doubled, the ICO market saw equally historic activity levels. In total, over $6B was raised in more than 382 ICO’s over the course of the year, with June and December recording the highest individual months.[xiii] With the rising success and popularity of Bitcoin and other cryptocurrencies, this hot ICO market is one clear piece of evidence that investors have become willing and anxious to allocate more capital into this new asset class.

Market Share Concentration

Source: CoinSpeaker

This was also a transformative year in the cryptocurrency market in terms of market share concentration. At the beginning of the year, Bitcoin held 87.4% of all capital invested in the crypto market. As its popularity came into the spotlight, and cryptocurrencies became more mainstream, over 914 new cryptocurrencies hit the market in 2017 alone. As a result, Bitcoin’s market share was reduced to 38.6% by year end.[xiv]

Source: CoinSpeaker

Growth Drivers

Economic Expansion

One unseen, but important factor in the rise of the cryptocurrency market is the recent economic expansion. Noting the history of cryptocurrencies – with blockchain and Bitcoin coming into existence in 2009 and Bitcoin’s subsequent upsurge after 2013 – it is easy to see that as market fears calmed after the 2008 recession, investors’ appetite for risk returned to pre-recession levels. And as the stock market experienced an almost all-time record year in 2017, investor confidence rode to historic highs as well – a perfect environment for the growth of a new type of risky investment asset.

Blockchain Technology

Blockchain has taken the technology world by storm with the rise of Bitcoin. Prior to the advent of blockchain technology, bitcoin and the rest of the cryptocurrency world were virtually worthless. Blockchain technology is simply a ledger that holds a sequence of transactions that update automatically across a series of independent databases located in multiple geographic locations. This technology has profound implications for many industries but has already had rapid effects on the currency and financial technology space. The increased efficiency, decreased transaction costs, and heightened security that blockchain provides gives cryptocurrencies nearly all of their value. It allows for users to create unforgeable and verifiable transactions, while avoiding the digital fees usually enacted by banks for online transactions. IBISWorld reports an expected 7.3% increase over the next five years to 2022 in services conducted online in connection with advances in blockchain technology.[xv] Since its introduction in 2008, the value of cryptocurrencies has grown at astronomical rates, which explains the exuberance and entrance into reverse mergers for digital assets. That growth and the integration of blockchain the financial sector is expected to continue.

Investor Appetite

One of the major drivers of the growth seen in the crypto market has simply been a large increase in investor appetite. Over the course 2017, cryptocurrencies received a large amount of attention from investment and government institutions which legitimized them as investment assets. In February and April, Japan issued laws requiring cryptocurrencies to register with the financial services agency – a step towards the legalization of cryptocurrencies. In June, Goldman Sachs announced that due to popular demand, their markets division would begin covering Bitcoin. And at the end of October, the CME announced it would begin issuing Bitcoin derivatives.[xvi] All of these events, among others, showcase the pent up investor demand for cryptocurrencies.

Attractive Investment Features

Decentralized: Monetary policy dictated by central banks can cause devaluation of centralized currencies. Whereas cryptocurrencies are not controlled by any government and therefore are not subject to the will of central banks and are only controlled by market dynamics.

Secure: Cryptocurrencies are, by definition, secure. The decentralized nature of blockchain technology allows for unforgeable, verifiable transactions to take place across several geographic locations. This calms many of the fears critics have raised for the past decade about cryptocurrencies.

Completely Digital: Because cryptocurrencies are completely virtual, there are practically no transportation costs whatsoever, nor transaction costs. Whereas even online banks may charge for transaction fees, the digital nature of cryptocurrencies significantly decreases the cost of digital transactions.

Growth in Value: With the rise of technology capable of using cryptocurrencies, the market has shown that there is a large desire for digital currencies. As a result, cryptocurrencies have a become a valuable method for holding and appreciating wealth.

Untapped Uses: Investors are seeing that this is only the beginning of the upturn for cryptocurrencies. There are several applications that are either beginning to be or that have yet to be explored. These include smart contracts, ESOP’s, capital raising and more.

Growth Restraints

Regulation

Regulator treatment of cryptocurrencies is not yet completely decided, however uncertainty over the future regulations to be placed on the investing and trading in the crypto market is a major limit on growth. In fact, a lack of regulatory oversight scares many would-be investors away and lends to the stereotype that cryptocurrencies are used only by gangs and criminals looking to launder money. Many investors are nervous that governments are looking to completely ban the use of cryptocurrencies as has already taken place in some countries.[xvii] Additionally, as regulators around the world have seen the appreciation in the crypto market and hope to capitalize on its growth, questions have been raised about the tax treatment of cryptocurrencies.[xviii] This year, the SEC disapproved of a Bitcoin ETF and declared tokens were “securities” thereby restricting their legal use to that of a normal security. Later in the year, the Chinese Central Bank declared that ICO’s were illegal.[xix] The crypto market has proven to be even more sensitive to news on regulation and government treatment than traditional stock exchanges. This trend of sensitivity, combined with continued uncertainty, will curb growth as much of the developed world is still trying to understand and institutionalize cryptocurrencies.

Volatility

As previously noted, the crypto market has seen extreme levels of volatility over the course of its ascension. Although certain investors would view this trend positively, there is a large portion of the world’s capital that is off-limits to cryptocurrencies because of their high volatility. Cryptocurrencies are so volatile for many reasons including:

No Intrinsic Value

Lack of Regulatory Oversight

Lack of Institutional Capital

Thin Order Books

Many of these are characteristic of immature markets and should be resolved over the course of the next decade as the market ages. But until these issues are solidified, volatility will continue to reign.

Cybercrime

Lastly, the growth of the cryptocurrency market is limited to the degree to which it can assure investors that their money will be safe. This seems to be traditional investing logic, but with the novel nature of cryptocurrencies, investors are especially cautious about the safety of their capital. Despite the security provided by blockchain technology, the crypto world is still completely digital and therefore prone to cyber-attacks. This has already occurred several times over the past 5 years with hundreds of millions of dollars being stolen by hackers.[xx]

Outlook

The cryptocurrency market appears to be a fixture of a new era of investing. Because of the plethora of new technologies that it employs and its applications in the several industries, cryptocurrencies are expected to continue to grow and eventually stabilize. Volatility will gradually subside over the coming decade as more regulation, a greater diversity of investors, and improved security measures enter the market.[xxi] Because of this, there will be a continued flow of capital into the crypto market as long term investors begin to invest and build a solid foundation for long term market growth.

Sources

[i] Dmitrii Kornilov et al., Cryptocurrency and ICO Market Overview for 2017 – CoinSpeaker CoinSpeaker (2018), https://www.coinspeaker.com/2018/01/04/cryptocurrency-ico-market-overview-2017/ (last visited Feb 24, 2018).

[ii] Global Charts, CoinMarketCap, https://coinmarketcap.com/charts/ (last visited Feb 28, 2018).

[iii] By, Cryptocurrency Volatility Index Sifr Data LLC (2018), https://www.sifrdata.com/cryptocurrency-volatility-index/ (last visited Feb 28, 2018).

[iv] S&P 500 Volatility In 2017 Was The Lowest In History (SPY), Yahoo! Finance (2017), https://finance.yahoo.com/news/p-500-volatility-2017-lowest-113321953.html (last visited Feb 28, 2018). “The maximum level reached by the VIX in 2017 was 17.28. That is the lowest maximum level attained in any year since inception — and 60% lower than the ‘average yearly max’.”

[v] Dmitrii Kornilov et al., Cryptocurrency and ICO Market Overview for 2017 – CoinSpeaker CoinSpeaker (2018), https://www.coinspeaker.com/2018/01/04/cryptocurrency-ico-market-overview-2017/ (last visited Feb 24, 2018).

[vi] Global Charts, CoinMarketCap, https://coinmarketcap.com/charts/ (last visited Feb 28, 2018).

[vii] Dmitrii Kornilov et al., Cryptocurrency and ICO Market Overview for 2017 – CoinSpeaker CoinSpeaker (2018), https://www.coinspeaker.com/2018/01/04/cryptocurrency-ico-market-overview-2017/ (last visited Feb 24, 2018).

[viii] Noah Jessop, 10 Predictions For The Next 5 Years Of Crypto Forbes (2017), https://www.forbes.com/sites/noahjessop/2017/12/01/10-predictions-for-the-next-5-years-of-crypto/#660eefb5a40d (last visited Mar 1, 2018).

[ix] Josiah Wilmoth, Cryptocurrency Market Cap to Reach $2 Trillion in 2018: Mike NovogratzCCN.com (2017), https://www.ccn.com/cryptocurrency-market-cap-to-reach-2-trillion-in-2018-mike-novogratz/ (last visited Mar 1, 2018).

[x] John Potter, Bitcoin Price Predictions for 2018: An Expert Roundup 99 Bitcoins (2108), https://99bitcoins.com/bitcoin-price-predictions-2018/ (last visited Mar 1, 2018).

[xi] Noah Jessop, 10 Predictions For The Next 5 Years Of Crypto Forbes (2017), https://www.forbes.com/sites/noahjessop/2017/12/01/10-predictions-for-the-next-5-years-of-crypto/#660eefb5a40d (last visited Mar 1, 2018).

[xii] Osi Momoh, Initial Coin Offering (ICO) Investopedia (2017), https://www.investopedia.com/terms/i/initial-coin-offering-ico.asp (last visited Mar 5, 2018).

[xiii] Dmitrii Kornilov et al., Cryptocurrency and ICO Market Overview for 2017 – CoinSpeaker CoinSpeaker (2018), https://www.coinspeaker.com/2018/01/04/cryptocurrency-ico-market-overview-2017/ (last visited Feb 24, 2018).

[xiv] Dmitrii Kornilov et al., Cryptocurrency and ICO Market Overview for 2017 – CoinSpeakerCoinSpeaker (2018), https://www.coinspeaker.com/2018/01/04/cryptocurrency-ico-market-overview-2017/ (last visited Feb 24, 2018).

[xv] Dylan Miller & Jonathan Hadad, Bit by Bit: Blockchain Takeover Media Center RSS (2017), https://www.ibisworld.com/media/2017/11/21/blockchain-technology/ (last visited Mar 5, 2018).

[xvi] Dmitrii Kornilov et al., Cryptocurrency and ICO Market Overview for 2017 – CoinSpeakerCoinSpeaker (2018), https://www.coinspeaker.com/2018/01/04/cryptocurrency-ico-market-overview-2017/ (last visited Feb 24, 2018).

[xvii] Rosie Perper, China is moving to eliminate all cryptocurrency trading with a ban on foreign exchanges Business Insider (2018), http://www.businessinsider.com/china-eliminates-all-cryptocurrency-trading-2018-2 (last visited Mar 5, 2018).

[xviii] Joe Barnes and Albert Evans, Bitcoin price WARNING: Cryptocurrency volatility ‘isn’t going away anytime soon Express.co.uk (2018), https://www.express.co.uk/finance/city/910448/bitcoin-price-USD-news-value-BTC-Ripple-ethereum-cryptocurrency-buy (last visited Mar 5, 2018).

[xix] Dmitrii Kornilov et al., Cryptocurrency and ICO Market Overview for 2017 – CoinSpeakerCoinSpeaker (2018), https://www.coinspeaker.com/2018/01/04/cryptocurrency-ico-market-overview-2017/ (last visited Feb 24, 2018).

[xx] Chukwudi Ibe @nitrospawngmail-com et al., 5 High Profile Cryptocurrency Hacks – (Updated)Blockgeeks (2017), https://blockgeeks.com/guides/cryptocurrency-hacks/ (last visited Mar 5, 2018).

[xxi] Arthur Iinuma, Why Is the Cryptocurrency Market So Volatile: Expert Take Cointelegraph(2018), https://cointelegraph.com/news/why-is-the-cryptocurrency-market-so-volatile-expert-take (last visited Mar 5, 2018).

William Montgomery contributed to this report."
2018-11-26 01:22:17+00:00	10 Tips For Cryptocurrency Trading You Probably Knew Nothing About	[]	Synthetic indices are becoming increasingly popular among traders throughout the world. However, there are still some misconceptions about them, which we will address in this... Read more →
