Date	Title	Authors	Text
2018-01-02 20:09:04+00:00	Cryptocurrency	[]	
2018-10-29 09:53:54+00:00	Bitcoin, Ethereum, XRP, and Crypto Market Outshines Global Stock Market Aiming for a Historic Reversal	['Achal Arya', 'Achal Is An Entrepreneur', 'A Product Designer With A Bachelors Degree In Computer Science. He Works In The Domain', 'Manages New Developments At Coingape. Follow Him On Twitter At']	"The global stock market is taking a downfall while experts share there is no positive catalyst for the market to go higher in future. Meanwhile, the crypto market is holding the fort as the top cryptos register greens and maintain stability.

Crypto Market Stable while Global Stock Market Seeing Red

The environment of the Crypto market is having gloomy days for some time now. There is almost no activity in the market despite the global share market taking a hit each passing day.

At the time of writing, Bitcoin (BTC) has been trading at $6,748 with 0.00 percent movement in the past 24 hours. The world’s leading cryptocurrency with a market cap of $112 billion is managing a low daily trading volume of $3.5 billion.

With a 0.12 percent rise, Ethereum (ETH) is trading at $204 billion while XRP, the third largest cryptocurrency is in the green by 0.18 percent at $0.4482.

Other cryptos in the green are Stellar (XLM) by 0.04 percent at $0.2299 while Monero (XMR) is up by 0.53 percent at $103 and Dash by 0.69 percent at $155. Bitcoin Cash (BCH), EOS, and Litecoin are rising by 0.34, 0.05 and 0.09 percent respectively.

Out of the top cryptos, Cardano (ADA) is in the red by 0.18% and Tron (TRX) is falling by 0.09 percent while IOTA (MIOTA) is down by 0.56 percent.

The highest gains are made of 13.11 percent by Nxt at $0.0672 and Polymath by 10.62 percent at $0.3259. A number of other cryptos are also up by 2 to 7 percent while the highest loss is of 7 percent.

This has total cryptocurrency market cap stuck at $209 billion in the past 24 hours.

Crypto market is unaffected by the ongoing fall in the global market, unlike the last time when cryptos lost significant value in tandem with the stock market.

Meanwhile, the global stock market is falling at a much higher speed than it lifted off. Chinese market seems to be doing the worst due to its slow economic growth and being in a trade war with the US.

Bloomberg quoted Michael O’Rourke, the chief market strategist at JonesTrading. “What’s the positive catalyst for the future to take this market higher to the next level? Right now, there isn’t one.”

After continuously gaining for approximately nine years, the stock market is taking a U-turn and looks like any factor even a small one can take it to the bottom. While cryptos are maintaining stability and keeping low volatility which has been characterized as a positive phenomenon is expected to have them become an attractive asset for the traditional investors

Mati Greenspan, senior analyst at eToro has been recently quoted as saying,

“The fact that the current stock market rout has not had any effect whatsoever (positive or negative) on the crypto assets is an extremely positive sign. This is a prime example of how cryptos are uncorrelated and it only serves to increase their use case as a powerful tool for asset management.”"
2018-06-10 23:00:59+00:00	Markets Update: Crypto Prices Take a Weekend Beating – Market Updates Bitcoin News	['Jamie Redman', 'Jamie Redman Is The News Lead At Bitcoin.Com News', 'A Financial Tech Journalist Living In Florida. Redman Has Been An Active Member Of The Cryptocurrency Community Since He Has A Passion For Bitcoin', 'Open-Source Code', 'Decentralized Applications. Since September', 'Redman Has Written More Than Articles For Bitcoin.Com News About The Disruptive Protocols Emerging Today.']	"Markets Update: Crypto Prices Take a Weekend Beating

Cryptocurrency markets are suffering from deep losses today, on June 10, 2018, as most digital assets are seeing 24-hour declines between 9 and 25 percent. The number one position, held by Bitcoin Core (BTC), dropped more than a $1,000 just a few hours ago, from $7,600 to $6,600, but prices have rebounded back to $6,787 per BTC. The fourth highest valued market, held by Bitcoin Cash (BCH), dropped around $225 in value after hovering around $1,150 for a while. The currency is now averaging $933 per BCH. It’s safe to say market participants are shaken and many are curious about why the market keeps sliding.

Also Read: CFTC Subpoenas Leading Exchanges for Trading Data

Crypto Markets Take a Jab to the Gut This Weekend

A dump took place today that hit markets below the belt, as most cryptocurrencies lost significant values. Last week, towards the beginning of the weekend, markets were pretty stable and consolidating tightly into a triangular formation. Then, on Saturday, the United States Commodity Futures Trading Commission (CFTC) and the U.S. Justice Department revealed they had subpoenaed four major exchanges while looking into their cryptocurrency price manipulation investigation. Just before that moment on June 9, just like last time when U.S. regulators initially announced the manipulation probe, markets slid about 1-hour before the announcement. Today’s drop was harder to put the blame on as it could have been an after effect from yesterday’s announcement, the fact that market volumes are extremely thin, or some blamed it on the small exchange from South Korea Coinrail being hacked this weekend for $40Mn worth of ICO tokens.

BTC Market Action

On Sunday, June 10, Bitcoin Core (BTC) markets are down 9.8 percent and over the past seven days, BTC markets are under by 11 percent. This means most of the losses have taken place this weekend as BTC volatility was fairly nonexistent at the beginning of the week. Right now BTC’s overall market capitalization is around $115Bn with a dominance level of around 38 percent. Trade volume is super weak and this is why a lot of traders are skeptical these days because 24-hour volumes today were around $4Bn, but since the last drop volumes jumped to $5.5Bn over the past hour. The top exchanges today swapping the most BTC are Bitfinex, Binance, Okex, Huobi, and GDAX. The Japanese yen is dominating BTC currency pairs big time commanding more than 60 percent of BTC trades at the time of publication. This is followed by the USD (19.2%) tether (USDT 13.5%), EUR (2.7%), and the KRW (2.2%). Of course, there was a significant drop in South Korean won-BTC pair action today.

BTC /USD Technical Indicators

Looking at the charts shows BTC bulls had mustered up some strength to push above the $6800 zone but the fight was a real struggle. 4-hour charts show the two Simple Moving Averages (SMA) have a good sized gap between them with the 200 SMA well above the 100 SMA trendline. This means bearish sentiment may continue during the short term and markets are very close to a triple bottom. After the last push the MACd is heading downwards and RSI levels are very low too (15.78) indicating oversold conditions. Daily Bollinger Bands (B-bands) are seeing a significant coil and buyers below the current vantage point are itching for lower prices. Looking at order books shows bears will see pit stops around $6,400 and the triple bottom $5,900 region. If bulls can heal right now, after that intense beating, then they need to overcome big walls around $7,300 and 7,800 to at least catch some fresh air from the onslaught.

BCH Market Action

After a few solid weeks of BTC being the dominant pair with Bitcoin Cash (BCH), today tether USDT has taken the lead at 31.77 percent. This is followed by BTC (31.5%), USD (21.9%), KRW (9.1%), and the EUR (1.9%). Bitcoin Cash has lost around 16.4 percent over the last 24-hours and 19 percent over the last seven days. This Sunday, the total market capitalization for BCH is around $15.9Bn with about $693Mn in 24-hour trade volume. The top trading platforms exchanging the most Bitcoin Cash today include Okex, Binance, Huobi, Bitfinex, and Lbank. The losses in BCH values have been very much correlated with BTC market tumbles but prices have still remained around 0.14 BTC per BCH.

BCH /USD Technical Indicators

Looking at BCH charts on Bitfinex shows similar indicators, as the two Simple Moving Averages have a decent gap like BTC with the 100 SMA below the long-term 200 SMA. Again, this indicates the path of least resistance will be towards the downside. RSI levels show oversold conditions (30) and the MACd is sliding southbound as well at the time of writing. Daily B-bands are also extremely tight, showing a massive consolidation period taking place. Looking at order books indicates that bears will have a hard fight until 910 and then another pit stop at $860. If things go lower than that, markets are going to look ugly all around. BCH bulls need to recharge and bust past $985 but buyers will also be deterred around $1,020, as sell orders are piling up around that region.

The Top Cryptocurrency Markets

Overall, the top cryptocurrencies are down, except for ‘stablecoins’ like tether and the various others allegedly pegged to the USD. The second largest market valuation today belongs to Ethereum (ETH) but its markets are down 13.9 percent. One ETH is trading for $517 and the currency is the most swapped coin on Shapeshift today, but traded for BTC. The third largest market, Ripple (XRP), is down 13.8 percent and one XRP is trading for $0.57 cents per token. Lastly, the fifth highest valued market commanded by EOS is down significantly at 21 percent this Sunday. At the moment, EOS is trading around $11.25 per coin and holds the fourth largest trade volume over the last 24-hours.

The Verdict: Skepticism and the Search for That Confounded Bottom

You can probably guess what our market verdict is today without reading the sub-title above, as things are looking bearish and everyone knows this fact. Because markets keep sliding, then recovering, then sliding downwards, even more, has caused enthusiasts and traders to be skeptical of any bullish signals. Most traders are looking curiously for ‘the bottom’ and when that time will be, so right now many are just playing musical chairs looking for the right positions.

Where do you see the price of BCH, BTC, and other coins headed from here? Let us know in the comments below.

Disclaimer: Price articles and markets updates are intended for informational purposes only and should not to be considered as trading advice. Neither Bitcoin.com nor the author is responsible for any losses or gains, as the ultimate decision to conduct a trade is made by the reader. Always remember that only those in possession of the private keys are in control of the “money.”

Images via Shutterstock, Trading View, and Satoshi Pulse.

Want to create your own secure cold storage paper wallet? Check our tools section."
2018-04-21 18:30:06+00:00	Bitcoin Nears $9,000 As Crypto Buy Orders Compose 92% of Market	['Sam Town', 'Chainwire', 'Samuel Wan', 'Andjela Radmilac', 'News Desk']	"For the first time since March 2017, buy orders now compose over 92% of market activity. Hot on the heels of a massive $120 billion recovery, the massive surge in buy orders heralds an impending bull market that could potentially exceed the monstrous late 2017 run up.

Data from TurtleBC demonstrates that cryptocurrency buy market percentage across a diverse range of coins including Bitcoin, Ethereum, Ripple, Dash, NEM, and money is currently at a massive 92.86%, greater than the December 2017 high of 88%.

Bitcoin Gains $1,000 in One Week

With so many buy orders placing pressure on the cryptocurrency market, a significant price shift is highly likely. Buy order presence isn’t the only indicator that hints toward a massive run up in the near future, however — with Bitcoin exhibiting a meteoric $1,000 jump over the last three days, investors are moving in quickly to capitalize on what is anticipated to be a return to the $10,000 BTC psychological barrier.

Cryptocurrency market observers are calling for a dramatic increase in Bitcoin values sooner rather than later. Notably, Fundstrat co-founder and head of research Thomas Lee has reiterated his frequent bullish predictions, forecasting a year-end target BTC value of $25,000.

In an interview with CNBC last week, Lee predicted a 225% increase from the $7,662 BTC value at the time of his statements:

“We still feel pretty confident that bitcoin is a great risk-reward and we think it could reach $25,000 by the end of the year … It’s overdue. Bitcoin was incredibly oversold”

While Lee is notorious within the cryptocurrency community for his consistently bullish position on Bitcoin, his prediction that selling pressure would ease subsequent to tax day in the US was correct.

Big Business Moves into Blockchain as Traditional Finance Remains Bearish

Early April has also seen a spate of institutional money — including major Wall Street players and financial juggernaut George Soros — enter the cryptocurrency market.

This significant flow of investment capital could contribute to market health as the blockchain industry matures.

While market sentiment is overwhelmingly positive, not all predictions are bullish. One of the most interesting predictions of the last month comes from Harvard economist Kenneth Rogoff, who stated in an interview with CNBC that Bitcoin is likely to trade at $100 per token by 2028 — disappointing news to John McAfee.

“I think Bitcoin will be worth a tiny fraction of what it is now if we’re headed out 10 years from now … I would see $100 as being a lot more likely than $100,000 ten years from now”

Rogoff, the former chief economist of the International Monetary Fund, appears unaware of the utility of BTC or the implications of Lightning Network implementation, stating that “if you take away the possibility of money laundering and tax evasion, its actual uses as a transaction vehicle are very small.”

The sheer level of capital that is currently being invested in the blockchain industry makes it highly unlikely that Bitcoin — the undisputed market cap king — will be falling from grace any time soon. Recent employment statistics demonstrate that blockchain-based job positions have doubled in the last three months as enterprise organizations prepare for the incoming blockchain revolution.

Blockchain is Here to Stay

As the oldest, most valuable, and most liquid crypto-asset, Bitcoin is considered the “gold standard” of the blockchain, and can be exchanged for virtually every other altcoin on the market.

There are now thousands of merchants that accept Bitcoin directly as payment, and with LocalBitcoin volume recently at an all time high, it’s never been easier to exchange BTC directly for fiat currency.

Bitcoin, altcoins, and blockchain technology is here to stay. Interestingly, the Delaware State Senate has recently passed an act that explicitly allows for the use of blockchains to maintain corporate share registries, making it highly likely that crypto-assets will replace traditional securities entirely.

With cryptocurrency buy order ratios reaching an all-time high and tax season finally over, the impending crypto bull run to end all bull runs isn’t just possible — it’s inevitable."
2018-04-24 23:30:01+00:00	‘All Hell Will Break Loose’: 1 in 5 Financial Firms Ready to Enter Crypto Market	['Adam James Lives In Budapest', 'Is The Managing Editor Of Bitcoinist.Com. He Digs Gibson Guitars That Sound Like Tyrannosauruses', 'Romantic', 'Victorian Poetry', 'Franco-Era Spanish Films', 'Lps', 'Chelsea Fc', 'Bob Dylan', 'Pilot', 'Black Coffee']	"How many financial firms are looking to get involved with cryptocurrency? Twenty percent, according to an industry poll conducted by Thomson Reuters — and that’s likely just the start.

The Herd is Approaching

A survey by Canadian multinational mass media and information firm Thomson Reuters found that 20 percent of its more than 400 clients are considering making a concerted push into the cryptocurrency market within the next half year.

Neill Penney, the co-head of trading at Thomson Reuters explained:

Cryptocurrency is still a relatively small part of the trading market, but this survey makes clear this niche segment is starting to enter the mainstream of the financial services industry. This is a major change from a year ago.

Indeed, even those in the financial world uninterested in the cryptocurrency market would be unwise to completely ignore its quick-profit potential. Bill Barhydt, the CEO of American Express-backed cryptocurrency startup Abra, told Business Insider last month:

I talk to hedge funds, high net worth individuals, even commodity speculators. They look at the volatility in the crypto markets and they see it as a huge opportunity. Once that happens, all hell will break loose.

Wall Street is Ready to Join the Party

Thomson Reuters’ results come after Goldman Sachs announced the hiring of former trader Justin Schmidt, who will head the multinational investment bank’s and financial services company’s digital asset markets in Goldman’s securities division.

Schmidt previously served as both a senior VP at Seven Eight Capital and portfolio manager at LMR Partners and has apparently been brought on by an increased interest in cryptocurrency from Goldman’s clients. Said Goldman Sach’s spokeswoman Tiffany Galvin-Cohen:

In response to client interest in various digital products, we are exploring how best to serve them in the space. At this point, we have not reached a conclusion on the scope of our digital asset offering.

The increased interest from Goldman’s clients coincides with a general increase in interest from Wall Street, at large — where many individuals were late to the party after last year’s epic bull run. Don’t expect them to miss the boat this time.

What do you think of the increased interest in Bitcoin and other cryptocurrencies from institutional investors? Do you think a tidal wave of trading is about to hit the market? Let us know in the comments below!

Images courtesy of iStockPhoto, AP"
2018-10-14 02:12:21+00:00	Cryptocurrency Market Update: A Lazy Sunday in Crypto Land	['Martin Is A Southeast Asia Based Info-Tech', 'Cyber Security', 'Cryptocurrency Analyst With Years Working In Web Technology']	"Crypto markets are horizontal today; Only Digitex Futures is pumping.

Cryptocurrency markets are still at the bottom following their mid-week dump. There has been no sign of a bounce back to previous levels as total market capitalization is still hovering just above $200 billion.

Bitcoin has remained on a flat line since its Thursday dump of $300. BTC fell to $6,300 and is currently trading just below that level, it has fallen 5% since the same time last weekend. Ethereum is also very depressed at the moment after falling back to $200 and remaining there for the past 3 days.

Altcoins are mostly in the red this morning, but movements are minimal. Looking at the top ten nothing is really moving more than a percent or so in either direction. Cardano has lost almost 2% on the day to fall back to $0.073. The rest are flat this Sunday during Asian trading.

The top twenty is showing similar lethargy at the moment with most cryptos shifting around a percent up or down on the day. Dash is showing the greatest gain which is just 1.7% bringing it to $161, while Tezos is falling back by a similar amount dropping it to $1.22.

The fomo induced pump of the day in the top one hundred is currently Digitex Futures which has surged 47% in the past 24 hours. These unnatural spikes usually happen when new altcoins increase in market cap but they often dump again just as quickly. Time will tell if DGTX can hold its gains. Aion has also done well since the dump, today it is up 18%. At the red end of the table is Noah Coin dumping all of its recent gains and falling back 26% on the day. MaidSafeCoin is also having a tough Sunday with an 11% slide.

Total crypto market capitalization has not moved over the past 24 hours and is still very low at $202 billion. Trade volume has dipped below $10 billion for the first time since the end of August and crypto markets look very dejected at the moment. Markets are back to the same level they were at this time last month which appears to be the bottom, unless another dump is imminent.

FOMO Moments is a section that takes a daily look at the top 20 altcoins during the current trading session and analyses the best performing ones, looking for trends and possible fundamentals."
2018-12-19 00:00:00+00:00	Are you a robot?	[]	"Why did this happen?

Please make sure your browser supports JavaScript and cookies and that you are not blocking them from loading. For more information you can review our Terms of Service and Cookie Policy."
2018-11-24 00:00:00+00:00	Bitcoin sinks below $4,000 as the crypto market takes another hefty beating – TechCrunch	['Lucas Matney']	"As we hang out with family and friends this holiday season, it’s interesting to look back on the Bitcoin mania that we endured one Thanksgiving ago. Aunts and uncles asking about internet money as you passed the mashed potatoes while trying to explain the concept of decentralization in a way that made it seem like you knew your stuff.

Well, as we near a year since many of the top tokens hit their all-time highs, we’ve seen the prices come crashing down as more manageable expectations of the crypto market have seemed to prevail. You probably didn’t have quite as many relatives picking your brain this year for crypto investment tips.

Today, we saw another hit to the market. All but eight of the top 100 cryptocurrency tokens are down for the 24-hour period, with most losses averaging around 13 or 14 percent.

Notably, Bitcoin has now fallen beneath the $4,000 threshold, a number it reached in August of last year as its trajectory pointed sharply upward. Ethereum is trading just over $111, while Litecoin has fallen below $30 — far cries from their former glory.

The cryptocurrency space is a volatile one, but the year-long downward trend has been consistent and unrelenting, leaving many to wonder where and when some of these top tokens will settle down."
