Date	Title	Authors	Text
2018-12-21 12:30:14+00:00	What the hell happened to crypto this year?	['About The Author', 'Cale Is A Brooklyn-Based Reporter. He Writes About Many Things.']	"It seems all too fitting that Facebook’s plans to launch a digital coin were leaked in the second-to-last week of a year that saw the tech giant’s reputation pummeled and cryptocurrencies crash and burn. It’s like grilling a shit sandwich over a dumpster fire.

advertisement

advertisement

Bitcoin–and the cryptocurrency industry as a whole–plunged this year, after a gravity-defying surge in recent years. The price of the digital coin hit nearly $20,000 late last year. And then in early 2018, it began to fall. Though it hit a few plateaus, the price has still tumbled; today it hovers at a little over $3,000. So what happened? And is there any hope for a recovery? To answer both, you have to look at quite a few factors. The bubble When bitcoin was rising last year, it seemed like a trend everyone from your grandmother to your barista was suddenly becoming hip to. Of course plenty of folks cautioned that it could be a bubble, but it’s always hard to realize such a thing when you’re in the midst of it. It’s free money, right? Why not get in on it? (Just don’t remortgage your house!)

advertisement

advertisement

All the signs, however, were there. Like previous bubbles, people were basing their belief in the cryptocurrency on their emotions, not any intrinsic value. Then there was the FOMO element, which only compounded things. Essentially, bitcoin became an international fever. Random companies were “pivoting to blockchain” for no apparent reason other than that it seemed like a way to create buzz. But when the bubble bursts, FOMO turns into fear of losing, which makes for an especially rapid plunge. Among those who called it, hedge fund manager Mark Dow wrote almost exactly a year ago about his decision to short bitcoin after future trading on it first began: But this time feels different. It feels like a bubble. The fever in the post-Thanksgiving moonshot ran hotter than we’d seen before. We also began to see a robust supply response. Bubbles are complex dynamics. What they all have in common, however, is they require emotion to truly go parabolic. Moreover, the less we understand the object of the bubble, the greater the scope for greed and FOMO to fill in the blanks. Dow, at the time, simply could not come up with a good reason for the crypto’s insane performance. The only logical explanation: It’s a bubble. His views were especially prescient. He told Bloomberg this month that he made a profit twice due to this canny call.

advertisement

Other early warning signs But to understand the dynamic that led to this year’s depressing year for crypto, we actually should start a few years before 2018. In bitcoin’s early days, Mt. Gox was the go-to service for handling transactions. Then, in 2014, it halted transactions and slowly copped to a crypto-hack to the tune of $473 million, the biggest hack of its kind at the time, and it gave many people pause. But it was still early enough for people to believe that the blockchain system was still getting all the technical kinks out. But the hacks didn’t stop. In 2016, the DAO–a blockchain organization that was based on Ethereum–lost what was worth $50 million at the time, due to a technical error someone seized upon. This, once again, sent shockwaves through the community–but also had the unfortunate impact of normalizing these types of hacks for some people. At the end of 2017 and beginning of 2018, more people–especially those in the mainstream finance world–were paying attention to bitcoin and cryptocurrency trading. And in early January 2018, the Japanese exchange Coincheck disclosed a hack worth a whopping $534 million. This happened right around the time that bitcoin slipped from its peak value, and it certainly seemed to accelerate its drop.

advertisement

According to Stephen Innes, the head of Asian trading for the foreign exchange Oanda, hacks were the first element to have a chilling effect on crypto. Hearing the amount of money that thieves were able to take, he says, “Consumers got very concerned that their money could go missing.” In the wake of both Coincheck’s hack–as well as a big one that hit the South Korean exchange Coinrail–governments in East Asia began to crack down. Over the course of a few months, China, Japan, and South Korea all announced different measures to better regulate crypto-trading. The world was watching to see if this new technology would hit the mainstream–and government crackdowns following gigantic hacks helped poison the public perception. Indeed, following its nearly $20,000 peak, bitcoin in early 2018 dropped to around $10,000 and hovered there for a while.

advertisement

Lack of institutional support Beyond the clampdown by some governments, what bitcoin really needed to achieve sustained success was overall mainstream acceptance. While some financial institutions announced projects exploring blockchain-based solutions, many others balked. JPMorgan CEO Jamie Dimon, for instance, made multiple comments throughout the year expressing his general antipathy for cryptocurrency. Dimon’s thoughts could most easily be summed with this quote: “I don’t really give a shit about bitcoin.” Warren Buffett also didn’t have kind words–calling it “probably rat poison squared”–which almost certainly sent a clear message to curious investors. When some of the most respected people on Wall Street make comments like that, it “takes a huge element of mainstream out of the market,” says Innes. Essentially, these heavy hitters were telling their minions that bitcoin wasn’t worth their time.

advertisement

Meanwhile, there has been plenty of speculation that bitcoin’s big rise may have been due to a pump-and-dump scheme. One theory that the U.S. Justice Department is reportedly looking into is that the digital coin Tether (which is supposedly pegged to the U.S. dollar to make for a less volatile cryptocurrency) was used to manipulate the bitcoin market and cause a large run-up in price. This theory stems from an academic paper, which cast Tether in a very damning light. And it also led many to believe that the initial bitcoin craze was manufactured and destined to bust. Another institutional hit for bitcoin–which probably had the most sustained effect–was the SEC’s refusal to approve a bitcoin exchange-traded fund (ETF). This would be a path for more mainstream people in finance to dabble with blockchain; it would allow investors to dip their toes in bitcoin without owning the actual asset. Not only that, but it would make bitcoin available on the most prominent financial markets. The U.S. Securities and Exchange Commission (SEC), however, has yet to allow such a fund to exist–mostly because it is unable to monitor crypto-transactions in order to avoid market manipulation. The inability to get SEC approval really held back bitcoin and cryptocurrencies in general. It sent the message, says Innes, “that there wasn’t underlying support from Wall Street.” Meanwhile, the price dropped from around $10,000 to $6,000.

advertisement

Internal battles But it wasn’t just outside pessimism that led to the slump, but infighting as well. Blockchains are decentralized, and democratic systems require buy-in from participants in order to keep the engines running. When there’s a schism that can’t be decided by the majority, all hell breaks loose. In 2016, this became apparent with the DAO hack. One way to fix the problem was to implement what’s known as a “hard fork,” which would essentially update the Ethereum-based software to fix the technical gaffe that caused the hack to begin with. But DAO users had to agree to this change, and there were dissenters. Though the hard fork was approved, it created two active blockchains with two different sets of rules. Ultimately, this hack–coupled with the inability to deal with it–caused the DAO to end in 2016. This year we saw a similar fight break out–this time over bitcoin cash. This coin, mind you, is not bitcoin, though it is built on the same architecture. It was created by a group of miners who disagreed with some of the fundamentals of the initial bitcoin system, and so they forked a new blockchain and went their own way. In terms of market capitalization, bitcoin cash has always been one of the top cryptocurrencies–in the ranks of Ethereum and XRP.

advertisement

This past autumn, the bitcoin cash community–which was created due to a technical disagreement with the larger bitcoin sector–started a civil war. Essentially, bitcoin cash developers had diverging views on the software update for the system, and so they decided to implement another hard fork. This created two new bitcoin cash sects. Internally, the fork caused a lot of strife; one of the most popular bitcoin alternatives was unable to reach a consensus, and instead had to create two different paths that would essentially go to war with each other. When the hard fork arrived–and participants had to choose which path to take–the entire cryptocurrency market dropped. This is very likely what caused bitcoin to drop from the $6,000 range to around the $3,000-$4,000 range. Which brings us to today, with the cryptocurrency bottoming out at less than 80% of what it was a year ago. Is there any hope? We’re certainly in a much different place now than we were 12 months ago. What was a hot commodity has turned into a hot potato nobody wants to touch. Still, this almost certainly won’t be the end for bitcoin, or cryptocurrencies as a whole. Despite the realization that it was a bubble, even the toughest critics see some sort of a future.

advertisement

Dow, the man who first shorted bitcoin, for instance, even mentioned in his initial post that a person can be “simultaneously bullish on blockchain and bearish on bitcoin.” And he just announced that he’s ending his short. Meanwhile, even the most enthusiastic bitcoin evangelists are realizing that a retooling is in order. Michael J. Casey, a senior adviser for blockchain research at MIT’s Digital Currency Initiative, recently wrote about how the crypto-winter has arrived, but it may lead to better things down the line: The good news is that the glare of public opinion will eventually dissipate, and that as the spotlight diminishes, real developers will find themselves in a healthier environment within which to do the work needed to unlock this technology’s potential. We saw a similar period of constructive building during the 2014-2016 hiatus. But whatever new products are produced, they will now have a harder time struggling with acceptance. Whether we like it or not, message and image are important. That seems to be the overall message from most. Even Innes, who has been critical of bitcoin and crypto-trading for quite a while, admits that this doesn’t mean the blockchain is bunk. He, in fact, sees things looking up. “If this base can hold,” he says, “[the price will] start drifting up.” But not because of fervor or blind faith that bitcoin is the future, but due to advances on the technology side.

advertisement

“This is a legitimate technology–it’s going to expand,” he says, “My longer-term view is nowhere near where some of [my current] views are.” It could even perhaps hit $10,000 again, he says. But that will probably take a few years. For now, we wait and see."
2018-02-02 00:00:00+00:00	January's Top Large Cap Crypto? Not Bitcoin or Ether...	[]	Bitcoin, the world's largest currency by market capitalization, dropped close to 30 percent, meaning its market capitalization shaved off billions after a torrid end to 2017. Meanwhile, excitement seemed to fade as the total value of all cryptocurrencies taken together topped out at $830 billion on Jan. 7, ending the month below $500 billion.
2018-05-01 00:00:00+00:00	More Big Cryptocurrency News at Trading Technologies: Announcing TT® Crypto	['Trading Technologies']	"Crypto. TT. And FREE.* Now that’s a combo worth writing about!

You can now trade cryptocurrencies for free through what we believe is the world’s greatest trading platform. Traders have been asking us for this functionality, and I’m excited to bring it to market. Yes, any exchange trading commission fees still apply, but we will charge no fees to use TT software. Here’s the scoop on that, with a little background to start.

Trading Technologies is a 24-year-old company providing software and services for the trading industry. Our lead product is a front-end platform simply known as TT®. Professional traders use TT as their trading interface to route orders to exchanges around the world. Most exchanges that TT connects to today are global futures exchanges. On March 1, we launched a connection to our first cryptocurrency spot market, Coinbase’s Global Digital Asset Exchange (GDAX). Traders are using TT today to trade spot crypto, and many are benefitting from having bitcoin futures and spot on the same screen by trading the difference between the two, known as the basis.

Today, we launched a separate and dedicated crypto-only version of our platform that we’re calling TT® Crypto. TT Crypto is a lightweight, cloud-based, scalable, high-performance (e.g., microsecond-fast) version of the TT platform.

With this sleek new infrastructure, we can now open it up to the masses and offer it for no fee. TT Crypto provides all the same functionality of TT that professional traders rely on, such as:

Customizable trading screen

Ability to do single-click trading on an elegant vertical trade ladder

Professional-grade charting and analytics tools

Advanced order types, such as bracket, iceberg, OCO, trailing limit and our own soon-to-be-released version of a post-only order type

Our Autospreader® engine for auto-trading differential levels between two different digital assets

Our ADL® DIY trading algorithm builder that allows a user to set logic based on their own creativity. ADL is a great tool for market-making programs. You can even import your own data through Excel.

24/7 market access—just like the exchanges

Fully functional mobile apps for iOS and Android, a rarity in crypto!

TT is not an exchange, we’re not a wallet or custodian, and we’re not a market-maker. We are a front-end system, and we route your orders to an exchange. We provide trading infrastructure. Today, we route orders to Coinbase’s GDAX exchange. In time, it is likely we will grow the list of exchanges we connect to.

To get set up to trade on TT Crypto, you first have to open and fund a GDAX account at www.gdax.com. Once you’ve done that, you can create a TT Crypto login at crypto.trade.tt and follow our easy steps to connect it to your Coinbase account.

So check it out today at tt-crypto.com. We’ve been doing this for many years, feel like we have a great product for the broader market, and we’re excited to see what kind of positive impact TT Crypto can have on maturing and furthering the efficiency of cryptocurrency markets.

*TT Crypto is free of charge. Note however that GDAX charges still apply."
2018-08-14 00:00:00+00:00	Ethereum is down another 10% as the global crypto market goes into 'panic mode'	['Oscar Williams-Grut']	"Ethereum is down another 10% on Tuesday after falling 17% on Monday.

The cryptocurrency market has lost 10% of its value in the past 24 hours.

Bitcoin dropped below $6,000 earlier in the session .

You can follow live cryptocurrency prices on Markets Insider.

LONDON — Ethereum's steep price fall continued on Tuesday as the entire cryptocurrency market continues to fall.

Ethereum is down just over 10% to $253.35 at 4.22 p.m. BST (11.22 a.m. ET). The current sell-off began on Monday, when Ethereum dropped to an 11-month low. Bloomberg reported that the slump was sparked by startups that had raised funding in ethereum through so-called initial coin offerings (ICOs) now cashing their holdings into traditional fiat money they can spend on development.

Matthew Newton, an analyst at eToro, said in an email: ""The crypto market seems to have hit panic mode, with prices falling significantly across the board. As we can see in the case of ether, investors seem to be increasing liquidations of their ICO holdings, with significant drops in price and increased volumes.""

As of Tuesday morning London time, the value of the overall cryptocurrency market had fallen by about 10% over the past 24 hours, according to CoinMarketCap.com, from $218 billion to $193 billion.

Bitcoin, the largest cryptocurrency by value, dropped below the psychologically significant level of $6,000 early in the session before fighting back. Bitcoin was down 3.7% to $6,020.24 at 4.24 p.m. BST (11.24 a.m. ET).

Other major cryptocurrencies were suffering similar drops at the same time:

The cryptocurrency market has been under pressure since late June, when the US Securities and Exchange Commission delayed a decision on whether to approve a bitcoin exchange-traded fund, a move that bitcoin bulls believe would have greatly increased the size of the market.

""If an ETF doesn't see the light in the coming weeks expect to see a further selloff, as it suggests regulators will continue to fight against bringing cryptocurrencies into the mainstream,"" Hussein Sayed, the chief market strategist at FXTM, said in an email on Tuesday morning, adding that a break below $5,770 for bitcoin would ""intensify selling pressure as it's the only major support still standing.""

The slump comes as emerging-market currencies are selling off, spooked by last week's collapse of the Turkish lira against the dollar. Neil Wilson, the chief market analyst at Markets.com, said in an email that this coincidence ""puts paid to the notion of cryptos as a safe haven play.""

""Ultimately USD and US Treasury notes are the only real safe harbour,"" Wilson said."
